"The Queen of Versailles","Documentary","In 2008, the Siegel family was top of the heap with the wealthy and politically influential David Siegel running the successful Westgate Resorts time-share business. To enjoy their good life, he and his engineer turned beauty queen trophy wife, Jackie, were building the largest single family private home in America. Suddenly, both the US economy and Westgate were rocked by the devastating sub-prime mortgage collapse. In the new economic reality with the business teetering on ruin, we follow the Siegels as they struggle to scale down their grotesquely ostentatious lifestyle. For this overprivileged family, accepting that situation proved a dispiriting struggle even as their unfinished dream home became a monument of their superficial values."
"5 Broken Cameras","Documentary","When his fourth son, Gibreel, is born, Emad, a Palestinian villager, gets his first camera. In his village, Bil'in, a separation barrier is being built and the villagers start to resist this decision. For more than five years, Emad films the struggle, which is led by two of his best friends, alongside filming how Gibreel grows. Very soon it affects his family and his own life. Daily arrests and night raids scare his family; his friends, brothers and himself are either shot or arrested. One Camera after another is shot at or smashed, each camera tells a part of his story."
"Fahrenheit 9/11","Documentary","Following up on 'Bowling for Columbine', film-maker Michael Moore provides deep and though-provoking insights on the American security system, the level of paranoia, fear, uncertainty, false values and patriotism, which all combined together to set a stage for George W. Bush to launch a war on Iraq instead of focusing on getting the real culprit(s) behind the terrorist attacks of September 11, 2001. This documentary also focuses on how some Saudis were safely and secretly flown out of America while planes were ostensibly grounded after the attacks. Archived film footage, candid interviews with politicians, and an overall waste of public funds for a war that was initiated on false pretension to wit: a weapon of mass distraction - to take the focus away from the real enemy and get Americans glued to their TV sets to watch innocent Iraqis and Afghans getting killed. And a war that would eventually alienate the U.S.A. and it's citizens from almost every country on Earth."
"Happy","Documentary,Drama,Family","HAPPY takes us on a journey from the swamps of Louisiana to the slums of Kolkata in search of what really makes people happy. Combining real life stories of people from around the world and powerful interviews with the leading scientists in happiness research, HAPPY explores the secrets behind our most valued emotion."
"Bully","Documentary","This year, over 13 million American kids will be bullied at school, online, on the bus, at home, through their cell phones and on the streets of their towns, making it the most common form of violence young people in this country experience. BULLY is the first feature documentary film to show how we've all been affected by bullying, whether we've been victims, perpetrators or stood silent witness. The world we inhabit as adults begins on the playground. BULLY opens on the first day of school. For the more than 13 million kids who'll be bullied this year in the United States, it's a day filled with more anxiety and foreboding than excitement. As the sun rises and school busses across the country overflow with backpacks, brass instruments and the rambunctious sounds of raging hormones, this is a ride into the unknown. For a lot of kids, the only thing that's certain is that this year, like every other, bullying will be a big part of whatever meets them at their school's front doors. Every school in the U.S. is grappling with bullying-each day more than 160,000 kids across the country are absent because they're afraid of being bullied-but for many districts it's just one more problem that gets swept under the rug. BULLY is a character-driven film. At its heart are those with the most at stake and whose stories each represent a different facet of this crisis. From the first day of school through the last, BULLY will intimately explore the lives of a few of the many courageous people bullying will touch this year."
"Undefeated","Documentary,Sport","A documentary that follows the Manassas Tigers football team, a severely underfunded and underprivileged football team -- who were even hired out as a practice team for more successful schools -- as they reverse their fortunes, thanks to coach Bill Courtney."
"Baraka","Documentary,War","Without words, cameras show us the world, with an emphasis not on "where," but on "what's there." It begins with morning, natural landscapes and people at prayer: volcanoes, water falls, veldts, and forests; several hundred monks do a monkey chant. Indigenous peoples apply body paint; whole villages dance. The film moves to destruction of nature via logging, blasting, and strip mining. Images of poverty, rapid urban life, and factories give way to war, concentration camps, and mass graves. Ancient ruins come into view, and then a sacred river where pilgrims bathe and funeral pyres burn. Prayer and nature return. A monk rings a huge bell; stars wheel across the sky."
"Blue Gold: World Water Wars","Documentary","Wars of the future will be fought over water as they are over oil today, as the source of human survival enters the global marketplace and political arena. Corporate giants, private investors, and corrupt governments vie for control of our dwindling supply, prompting protests, lawsuits, and revolutions from citizens fighting for the right to survive. Past civilizations have collapsed from poor water management. Can the human race survive?"
"West of Memphis","Documentary","West of Memphis is an examination of a failure of justice in Arkansas. The documentary tells the hitherto unknown story behind an extraordinary and desperate fight to bring the truth to light. Told and made by those who lived it, the filmmakers' unprecedented access to the inner workings of the defense, allows the film to show the investigation, research and appeals process in a way that has never been seen before; revealing shocking and disturbing new information about a case that still haunts the American South."
"Beauty Is Embarrassing","Documentary,Biography,Comedy","Raised in the Tennessee mountains, Wayne White started his career as a cartoonist in NYC. He quickly found success as one of the creators of the Pee-wee's Playhouse TV show which soon led to more work design some of the most arresting and iconic images in pop culture. Recently his word paintings featuring pithy and and often sarcastic text statements finely crafted onto vintage landscape paintings have made him a darling of the fine art world. The movie chronicles the vaulted highs and crushing lows of an artist struggling to find peace and balance between his professional work and his personal art. This is especially complicated for a man who struggles with the virtues he most often mocks in his art...Vanity, ego and fame."
"Detropia","Documentary","The woes of Detroit are emblematic of the collapse of the U.S. manufacturing base. Is the Midwestern icon actually a canary in the American coal mine? DETROPIA is a cinematic tapestry of a city and its people who refuse to leave the building, even as the flames are rising."
"Chasing Ice","Documentary,Biography","'National Geographic' photographer James Balog was once a skeptic about climate change. But through his Extreme Ice Survey, he discovers undeniable evidence of our changing planet. In 'Chasing Ice,' we follow Balog across the Arctic as he deploys revolutionary time-lapse cameras designed for one purpose: to capture a multi-year record of the world's changing glaciers. Balog's hauntingly beautiful videos compress years into seconds and capture ancient mountains of ice in motion as they disappear at a breathtaking rate. Traveling with a young team of adventurers by helicopter, canoe and dog sled across three continents, Balog risks his career and his well-being in pursuit of the biggest story in human history. As the debate polarizes America and the intensity of natural disasters ramp up around the world, 'Chasing Ice' depicts a heroic photojournalist on a mission to gather evidence and deliver hope to our carbon-powered planet"
"Happy People: A Year in the Taiga","Documentary","In vast pristine parts of Siberia's taiga (forest), life changed little over centuries, essentially remaining dependent on nature and the rhythm of the seasons. Some indigenous people of the village Bakhtia at the river Yenisei show how most aspects of daily/annual life are still passed on from father(-figure) to knave, such as logging and hunting, often using the same natural materials, with an occasional technological innovation, such as the chainsaw."
"Up the Yangtze","Documentary","A luxury cruise boat motors up the Yangtze - navigating the mythic waterway known in China simply as "The River." The Yangtze is about to be transformed by the biggest hydroelectric dam in history. At the river's edge - a young woman says goodbye to her family as the floodwaters rise towards their small homestead. The Three Gorges Dam - contested symbol of the Chinese economic miracle - provides the epic backdrop for Up the Yangtze, a dramatic feature documentary on life inside modern China."
"Alone in the Wilderness","Documentary","Documentary tells the story of Dick Proenneke who, in the late 1960s, built his own cabin in the wilderness at the base of the Aleutian Peninsula, in what is now Lake Clark National Park. Using color footage he shot himself, Proenneke traces how he came to this remote area, selected a homestead site and built his log cabin completely by himself. The documentary covers his first year in-country, showing his day-to-day activities and the passing of the seasons as he sought to scratch out a living alone in the wilderness."
"Cocaine Cowboys","Documentary,Crime","In the 1980s, ruthless Colombian cocaine barons invaded Miami with a brand of violence unseen in this country since Prohibition-era Chicago - and it put the city on the map. "Cocaine Cowboys" is the true story of how Miami became the drug, murder and cash capital of the United States, told by the people who made it all happen."
"The One Percent","Documentary","In this hard-hitting but humorous documentary, director Jamie Johnson takes the exploration of wealth that he began in Born Rich one step further. The One Percent, refers to the tiny percentage of Americans who control nearly half the wealth of the U.S. Johnson's thesis is that this wealth in the hands of so few people is a danger to our very way of life. Johnson captures his story through personal interviews with Robert Reich, Adnan Khashoggi, Bill Gates Sr., and Steve Forbes, during which both Johnson's and his subjects' knowledge and humor shine. And he's not afraid to butt heads with Milton Friedman, the economist who coined the term "the trickledown effect." He also shows how the other half lives, using real-world examples of the wealth gap: he takes a tour of a dilapidated housing project in Chicago, rides around with an enlightened taxi driver, and sees the human toll of the unfair economics of the Florida sugar industry. Johnson's film is at its most powerful when it reveals how the super-rich work to preserve their own monetary dominance. As a member of the "Johnson & Johnson" family, he gets rare access to an exclusive wealth conference at which the über rich learn strategies for preserving their fortunes, and learns the personal management styles of some of the countries wealthiest employers. No great society has survived such a massive wealth gap; who knows if ours will?"
"Dear Zachary: A Letter to a Son About His Father","Documentary,Crime,Drama","In 2001, Andrew Bagby, a medical resident, is murdered not long after breaking up with his girlfriend. Soon after, when she announces she's pregnant, one of Andrew's many close friends, Kurt Kuenne, begins this film, a gift to the child. Friends, relatives, and colleagues say warm and loving things about Andrew, home movies confirm his exuberance. Andrew's parents, Kathleen and David, move to Newfoundland, Canada where the ex-girlfriend has gone. They await an arrest and trial of the murderer. They negotiate with the ex-girlfriend to visit their grandchild, Zachary, and they seek custody. Is there any justice; is Zachery a sweet and innocent consolation for the loss of their son?"
"Jiro Dreams of Sushi","Documentary","In the basement of a Tokyo office building, 85 year old sushi master Jiro Ono works tirelessly in his world renowned restaurant, Sukiyabashi Jiro. As his son Yoshikazu faces the pressures of stepping into his father's shoes and taking over the legendary restaurant, Jiro relentlessly pursues his lifelong quest to create the perfect piece of sushi."
"Facing Ali","Documentary,Sport","The life and career of Muhammad Ali (1942- ) as seen chronologically in archival footage: Ali as a fighter, a personality, a political lightening rod, and a man. Boxers who fought him describe what led up to major fights and the matches themselves; they also offer personal revelations about their own lives: George Chuvalo's family losses, George Foreman's conversion, Ken Norton's gratitude, Ron Lyle's teaching, Earnie Shaver's encounter with the Klan, and Joe Frazier's good humor pack their own punch. The fighters talk about Ali's quickness, cunning, and recuperative powers - and how fighting him changed their lives."
"Ai Weiwei: Never Sorry","Documentary","AI WEIWEI: NEVER SORRY is the first feature-length film about the internationally renowned Chinese artist and activist, Ai Weiwei. In recent years, Ai has garnered international attention as much for his ambitious artwork as his political provocations. AI WEIWEI: NEVER SORRY examines this complex intersection of artistic practice and social activism as seen through the life and art of China's preeminent contemporary artist. From 2008 to 2010, Beijing-based journalist and filmmaker Alison Klayman gained unprecedented access to Ai Weiwei. Klayman documented Ai's artistic process in preparation for major museum exhibitions, his intimate exchanges with family members and his increasingly public clashes with the Chinese government. Klayman's detailed portrait of the artist provides a nuanced exploration of contemporary China and one of its most compelling public figures."
"How to Survive a Plague","Documentary,History,News","In the early years of the AIDS epidemic, the disease was considered a death sentence affecting communities, like the LGBT ones, whom many in power felt deserved it. This film tells the story of how militant activists like ACT-UP and TAG pushed for a meaningful response to this serious public health problem. As the activists struggled against political indifference, religious hostility, corporate greed and apparently skewed scientific research priorities with determination and sheer audacity, they produced a political wave that would lead to not only an effective treatment regime, but would advance LGBT rights beyond anyone's expectations."
"The Last Lions","Documentary,Family","Fifty years ago there were close to half-a-million lions in Africa. Today there are around 20,000. To make matters worse, lions, unlike elephants, which are far more numerous, have virtually no protection under government mandate or through international accords. This is the jumping-off point for a disturbing, well-researched and beautifully made cri de coeur from husband and wife team Dereck and Beverly Joubert, award-winning filmmakers from Botswana who have been Explorers-in-Residence at National Geographic for more than four years. Pointing to poaching as a primary threat while noting the lion's pride of place on the list for eco-tourists-an industry that brings in 200 billion dollars per year worldwide-the Jouberts build a solid case for both the moral duty we have to protect lions (as well as other threatened "big cats," tigers among them) and the economic sense such protection would make. And when one takes into account the fact that big cats are at the very top of the food chain-and that their elimination would wreak havoc on all species below them, causing a complete ecosystem collapse-the need takes on a supreme urgency."
"March of the Penguins","Documentary","Each winter, alone in the pitiless ice deserts of Antarctica, deep in the most inhospitable terrain on Earth, a truly remarkable journey takes place as it has done for millennia. Emperor penguins in their thousands abandon the deep blue security of their ocean home and clamber onto the frozen ice to begin their long journey into a region so bleak, so extreme, it supports no other wildlife at this time of year. In single file, the penguins march blinded by blizzards, buffeted by gale force winds. Guided by instinct, by the otherworldly radiance of the Southern Cross, they head unerringly for their traditional breeding ground where--after a ritual courtship of intricate dances and delicate maneuvering, accompanied by a cacophony of ecstatic song--they will pair off into monogamous couples and mate. The females remain long enough only to lay a single egg. Once this is accomplished, exhausted by weeks without nourishment, they begin their return journey across the ice-field to the fish-filled seas. The male emperors are left behind to guard and hatch the precious eggs, which they cradle at all times on top of their feet. After two long months during which the males eat nothing, the eggs begin to hatch. Once they have emerged into their ghostly white new world, the chicks can not survive for long on their fathers' limited food reserves. If their mothers are late returning from the ocean with food, the newly-hatched young will die. Once the families are reunited, the roles reverse, the mothers remaining with their new young while their mates head, exhausted and starved, for the sea, and food. While the adults fish, the chicks face the ever-present threat of attack by prowling giant petrels. As the weather grows warmer and the ice floes finally begin to crack and melt, the adults will repeat their arduous journey countless times, marching many hundreds of miles over some of the most treacherous territory on Earth, until the chicks are ready to take their first faltering dive into the deep blue waters of the Antarctic."
"Sicko","Documentary,Drama,History","In this documentary, the director/writer Michael Moore exposes the dysfunctional North American health care system, oriented to huge profits and not for their mission of saving lives. Further, he shows the corruption in the political system, with members of government and congress "bought" by the corporations and the situation of the average American citizens, including those that volunteered to work in the rescue mission of the September 11th. Then he travels to Canada, Great Britain and France to compare their systems showing their hospital, doctors, staffs and patients. Last but not the least, he shows that the prisoners in Guantanamo have better medical treatment than the common people in USA, and he ends getting free treatment to the Americans that participate along the documentary in Cuba."
"Capitalism: A Love Story","Documentary","Most Americans believe that capitalism is a system of the production and distribution of preferred goods and services in return for what consumers are willing to pay for them, and that this system is the bedrock on which the United States is built and upon which the country should function. This system may have functioned well in the United States in the post World War II era when there was little global competition and which truly established the middle class. However capitalism as seen in the United States today, which truly took hold in the Reagan era, is more about the want of the wealthy to get wealthier at the expense of all others. The country at that time started to be run more like a business than like a traditional government. Since, there has been a manipulation by the power brokers on Wall Street of government for their benefit, often at the expense of the the dwindling middle class and working class, and often without that production of a good or service demanded by society. The system continues to operate as most Americans strive to be among the wealthy and see capitalism as a system where becoming wealthy is at least possible. Capitalism is often associated with the ideals of Christianity and the concurrent American ideal of democracy, the latter which is increasingly not the case, where economic power is held in the hands of the few. Corporate America's biggest fear is democracy where in a one person/one vote system, a wealthy person has as much power as a poor person. With the poor increasingly outnumbering the wealthy, the poor banding together may show capitalism for what it is, at least in today's global system."
"Bowling for Columbine","Documentary,History","Filmmaker Michael Moore sets out to explore the reason(s) behind the massacre of 12 students and a teacher at Columbine High School on April 20, 1999. He documents how two students, Eric Harris and Dylan Klebold, easily acquired four pieces of firearms, despite of having a history of arrests, juvenile detention, counseling sessions, and drug dependencies. He documents how the U.S. has ended up as a country with the highest number of gun-related killings on Earth. With interviews with people like Charlton Heston, former President of the National Rifle Association, who lives in a fortified mansion, Moore shows how easy it is to acquire guns and munitions - with examples of a bank giving a free gun just for opening a bank account, and of one particular municipality that makes gun-ownership mandatory. Moore then links the involvement of the U.S. with tyrants and terrorists such as Saddam Hussein and Osama Bin Laden for its' own narrow gains - resulting in deaths of millions of civilians from 1953 through to 2001 - and its' refusal to review and change it's now notorious 'Foreign Policy'."
"The Cove","Documentary,Crime","Richard O'Barry was the man who captured and trained the dolphins for the television show Flipper (1964). O'Barry's view of cetaceans in captivity changed from that experience when as the last straw he saw that one of the dolphins playing Flipper - her name being Kathy - basically committed suicide in his arms because of the stress of being in captivity. Since that time, he has become one of the leading advocates against cetaceans in captivity and for the preservation of cetaceans in the wild. O'Barry and filmmaker 'Louie Psihoyos (I)' go about trying to expose one of what they see as the most cruel acts against wild dolphins in the world in Taiji, Japan, where dolphins are routinely corralled, either to be sold alive to aquariums and marine parks, or slaughtered for meat. The primary secluded cove where this activity is taking place is heavily guarded. O'Barry and Psihoyos are well known as enemies by the authorities in Taiji, the authorities who will use whatever tactic to expel the two from Japan forever. O'Barry, Psihoyos and their team covertly try to film as a document of conclusive evidence this cruel behavior. They employ among others Hollywood cameramen and deep sea free divers. They also highlight what is considered the dangerous consumption of dolphin meat (due to its high concentration of mercury) which is often sold not as dolphin meat, and the Japanese government's methodical buying off of poorer third world nations for their support of Japan's whaling industry, that support most specifically at the International Whaling Commission."
"Freakonomics","Documentary","The field of economics can study more than the workings of economies or businesses, it can also help explore human behavior in how it reacts to incentives. Economist Steven D. Levitt and journalist Stephen J. Dubner host an anthology of documentaries that examines how people react to opportunities to gain, wittingly or otherwise. The subjects include the possible role a person's name has for their success in life, why there is so much cheating in an honor bound sport like sumo wrestling, what helped reduce crime in the USA in the 1990s onward and we follow an school experiment to see if cash prizes can encourage struggling students to improve academically."
"Waiting for 'Superman'","Documentary","Filmmaker Davis Guggenheim reminds us that education "statistics" have names: Anthony, Francisco, Bianca, Daisy, and Emily, whose stories make up the engrossing foundation of WAITING FOR SUPERMAN. As he follows a handful of promising kids through a system that inhibits, rather than encourages, academic growth, Guggenheim undertakes an exhaustive review of public education, surveying "drop-out factories" and "academic sinkholes," methodically dissecting the system and its seemingly intractable problems."
"Restrepo","Documentary,War","Sebastian Junger and Tim Hetherington's year dug in with the Second Platoon in one of Afghanistan's most strategically crucial valleys reveals extraordinary insight into the surreal combination of back breaking labor, deadly firefights, and camaraderie as the soldiers painfully push back the Taliban."
"Grizzly Man","Documentary,Biography","For thirteen consecutive summers, the American Timothy Treadwell moved to Katmai in the Alaskan Peninsula to live among the grizzly bears, with the pretext of studying and protecting them. In 2003, his girlfriend Amie Huguenard and he were surprisingly attacked and eaten by a bear. Werner Herzog somehow accessed more than one hundred hours of footages filmed by Timothy and released this documentary, showing the life and death of Timothy Treadwell."
