"My Kid Could Paint That","Documentary,Family,Mystery","Four year old Marla Olmstead from Binghamton, New York became the sensation of the art world for her abstract artwork, which have sold for thousands of dollars per piece. The showing of her work started off as a lark, but when the paintings sold without the buyers knowing who the artist was, the media began to run with the story. Through it all, Marla's parents, Mark Olmstead and Laura Olmstead, want to be grounded in what is best for their daughter while exposing her to whatever positive may come from the experience. But some negative and big name media also surfaces, some questioning whether Marla is the real artist behind the work, and some questioning exposing a four year old to such infamy. Regardless, the fact of this art selling brings up the legitimacy of abstract art being quantified as "quality", especially if a four year old can produce it but can't express the emotions or rationale behind its creation. Or is art truly in the eyes of the beholder? Regardless, money, in the art world as is much in life, becomes the great equalizer."
"Maxed Out: Hard Times, Easy Credit and the Era of Predatory Lenders","Documentary","When Hurricane Katrina ravaged America's Gulf Coast, it laid bare an uncomfortable reality-America is not only far from the world's wealthiest nation; it is crumbling beneath a staggering burden of individual and government debt. Maxed Out takes us on a journey deep inside the American debt-style, where everything seems okay as long as the minimum monthly payment arrives on time. Sure, most of us may have that sinking feeling that something isn't quite right, but we're told not to worry. After all, there's always more credit! Maxed Out shows how the modern financial industry really works, explains the true definition of "preferred customer" and tells us why the poor are getting poorer and the rich getting richer. By turns hilarious and profoundly disturbing, Maxed Out paints a picture of a national nightmare which is all too real for most of us."
"9/11: The Falling Man","Documentary","The Falling Man is a documentary that examines one of the many images that were circulated by the press immediately after the attacks on the World Trade Center on September 11th, 2001. The image in question can be seen above on the cover of the disc. It shows a man plummeting headfirst to the ground, having leapt from the burning towers. After touching on the events of the day and how the nation reacted, the program focuses specifically on this image, the photographer who took it, its subsequent circulation, the public's reaction to it and why it was later deemed UN-newsworthy."
"Sick: The Life & Death of Bob Flanagan, Supermasochist","Documentary","Documentary about writer and performance artist Bob Flanagan who died at 43 of cystic fibrosis. His life was indicated by pain from the beginning and he started to develop sadomasochistic practices, which he developed finally into performances."
"Fat Head","Documentary","A comedian replies to the "Super Size Me" crowd by losing weight on a fast-food diet (including plenty of double-cheeseburgers and fried chicken) while demonstrating that almost everything you think you know about the obesity "epidemic" and healthy eating is wrong."
"I Think We're Alone Now","Documentary","Every celebrity deals with his or her share of obsessed fans. "I Think We're Alone Now" is a documentary that focuses on two individuals, Jeff and Kelly, who claim to be in love with the 80's pop singer Tiffany. Jeff Turner, a 50-year-old man from Santa Cruz, California has attended Tiffany concerts since 1988. Diagnosed with Asperger's syndrome, he never had a girlfriend. Jeff spends his days hanging out on the streets of Santa Cruz, striking up conversations with anyone who has a moment to spare. Kelly McCormick is a 38-year-old hermaphrodite from Denver, Colorado, who claims to have been friends with Tiffany as a teenager. She credits Tiffany as the shining star who has motivated her to do everything in her life. Both Jeff and Kelly have been labeled stalkers by the media and other Tiffany fans. This film takes you inside the lonely lives these two characters, revealing the source of their clinging obsessions. This age-old story of unrequited love takes a comedic and emotional trip through themes of desperation, isolation, and hope, in the end showing that having something, or someone, to believe in can be more powerful than anything reality has to offer."
"Full Tilt Boogie","Documentary","A docu-drama about filming From Dusk Till Dawn (1996). Sarah Kelly takes a non-union film crew onto the set and on location near Barstow of this independent, non-union production. Camaraderie and a constant eye on the shooting schedule dominate interactions. Quentin Tarantino and George Clooney mug for Kelly's camera; Robert Rodriguez, Juliette Lewis and Fred Williamson talk about craft; we watch scenes being shot; and Kelly asks crew members why they do what they do. Also, the International Alliance of Theatrical Stage Employees protests the non-union status of 'From Dusk Till Dawn', executive producer Lawrence Bender tells his side, and Kelly talks to a Variety reporter and others. What's the nature of an indie film?"
"Surfwise","Documentary,Sport","The inspiring and tumultuous story of 85-year old surfer, health advocate and sex guru, Dr. Dorian "Doc" Paskowitz, his wife Juliette, and their nine children who were all home-schooled and raised in a small camper on the beach, where they surfed and had to adhere to the strict diet and lifestyle of animals in the wild."
"The Elephant in the Living Room","Documentary","The Elephant in the Living Room takes viewers on a journey deep inside the controversial American subculture of raising the most dangerous animals in the world, as common household pets. Set against the backdrop of a heated national debate, director Michael Webber chronicles the extraordinary story of two men at the heart of the issue - Tim Harrison, an Ohio police officer whose friend was killed by an exotic pet; and Terry Brumfield, a big-hearted man who struggles to raise two African lions that he loves like his own family. In the first of many unexpected twists, the lives of these two men collide when Terry's male lion escapes its pen and is found attacking cars on a nearby highway. Winner of 5 Best Documentary Awards, the film courageously exposes the shocking reality behind the multi-billion dollar exotic pet industry with stunning photography, inspiring storytelling and unprecedented access into a world rarely seen, right in our own backyard."
"Trekkies","Documentary","From a TV series that barely lasted three seasons in the 1960s, "Star Trek" has grown into a multibillion-dollar industry involving several spin-off series, numerous movies, and countless merchandise items. This phenomenon is due to the show's legions of rabidly devoted fans, popularly known as "Trekkies." "Star Trek" actress Denise Crosby provides an affectionate and humorous look at some of these people, who demonstrate how "Star Trek" has affected and even shaped their lives. Several members of the show's cast and creative team also describe what the series and its fans mean to them."
"Let There Be Light","Documentary,War","The final entry in a trilogy of films produced for the U.S. government by John Huston. This documentary film follows 75 U.S. soldiers who have sustained debilitating emotional trauma and depression. A series of scenes chronicle their entry into a psychiatric hospital, their treatment and eventual recovery."
"American Swing","Documentary","The parallel stories of Plato's Retreat, a Manhattan sex club for straight couples that operated from 1977 until the mid 1980s, and of Larry Levenson, the club's impresario. In present-day interviews, Larry's family talks about him, while writers, reporters, and clients talk about the club. Mixed with these interviews are still photographs and archival footage of the club, Larry's appearances on talk shows, and newspaper articles. By the late 70s, the club was in full swing, with talk of Plato's Retreats in other cities. By the end of the decade, tax problems had Larry in trouble with the IRS and changing mores gave the club a different vibe. Then AIDS became an epidemic."
"Empire of Dreams: The Story of the 'Star Wars' Trilogy","Documentary,History","The most comprehensive look at the making of the Star Wars trilogy ever produced. This 2 and a half hour special examines the early concepts, the deals, the productions hell and then the eventual success of George Lucas' space opera. With commentaries from the cast and crew and stories about how a little movie that was looked upon as an impending box office disaster and became a cultural phenomenon. Then Lucas discusses how this tug-of-war with the Hollywood system forced him to turn his back on them and make The Empire Strikes Back (1980) and Return of the Jedi (1983) completely on his own."
"The Garden","Documentary","The 14 acre community garden in South Central Los Angeles was the largest of it's kind in the United States. It was started as a form of healing after the devastating L.A. riots in 1992. Since that time, the South Central Farmers have created a miracle in one of the country's most blighted neighborhoods. Growing their own food. Feeding their families. Creating a community. But now bulldozers threaten their oasis. The Garden is an unflinching look at the struggle between these urban farmers and the City of Los Angeles and a powerful developer who want to evict them and build warehouses."
"The Lottery","Documentary,Drama,News","In a country where 58% of African American 4th graders are functionally illiterate, The Lottery uncovers the failures of the traditional public school system and reveals that hundreds of thousands of parents attempt to flee the system every year. The Lottery follows four of these families from Harlem and the Bronx who have entered their children in a charter school lottery. Out of thousands of hopefuls, only a small minority will win the chance of a better future. The Lottery uncovers a ferocious debate surrounding the education reform movement. Interviews with politicians and educators explain not only the crisis in public education, but also why it is fixable. A call to action to avert a catastrophe in the education of American children, The Lottery makes the case that any child can succeed."
"Southern Comfort","Documentary","Southern Comfort documents the final year in the life of Robert Eads, a female-to-male transsexual. Eads, diagnosed with ovarian cancer, was turned down for treatment by two dozen doctors out of fear that treating such a patient would hurt their reputations. By the time Eads received treatment, the cancer was too advanced to save his life. Filmmaker Kate Davis follows Robert and a group of trans-gendered Southerners in this captivating and truly touching documentary."
"Machete Maidens Unleashed!","Documentary","Karate-kicking midgets! Paper-mache monsters! Busty babes with blades! Filipino genre films of the '70s and '80s had it all. Boasting cheap labour, exotic scenery and non-existent health and safety regulations, the Philippines was a dreamland for exploitation filmmakers whose renegade productions were soon engulfing drive-in screens around the globe like a tidal schlock-wave! At last, the all-too-often overlooked world of drive-in filler from Manilla gets the Mark Hartley (NOT QUITE HOLLYWOOD) treatment in Machete Maidens Unleashed! This is the ultimate insiders' account of a faraway backlot where stunt men came cheap, plot was obsolete and the make-up guy was packing heat! Machete Maidens Unleashed! features interviews with cult movie icons Roger Corman, Joe Dante, John Landis, Sid Haig, Eddie Romero and a large assembly of cast, crew and critics, each with a jaw-dropping story to tell about filmmaking with no budget, no scruples, no boundaries and - more often than not - no clothes. Strap yourselves in - and join us for a non-stop Filipino femme-fest, all the way from the jungles of the Pacific via the trash cans of the critics!"
"Tales from the Script","Documentary","Shane Black ("Lethal Weapon"), John Carpenter ("Halloween"), Frank Darabont ("The Shawshank Redemption"), William Goldman ("The Princess Bride"), Paul Schrader ("Taxi Driver"), and dozens of other Hollywood screenwriters share hilarious anecdotes and penetrating insights in "Tales from the Script," the most comprehensive documentary ever made about screenwriting. By analyzing their triumphs and recalling their failures, the participants explain how successful writers develop the skills necessary for toughing out careers in one of the world's most competitive industries. They also reveal the untold stories behind some of the greatest screenplays ever written, describing their adventures with luminaries including Harrison Ford, Stanley Kubrick, Joel Silver, Martin Scorsese, and Steven Spielberg. The film was produced in tandem with the upcoming HarperCollins book of the same name."
"Prom Night in Mississippi","Documentary","In 1997, Academy award winning actor, Morgan Freeman, who lives in the Charleston, Mississippi community, offered to fund the first-ever integrated Senior Prom in the history of Charleston's one high school. His offer was ignored. In 2008, Morgan offered again... the East Tallahatchie County School Board accepted. In this town of 2,300 people, its high school of 415 black and white students has, to this day, always had separate proms: one black, one white prom. Our film follows the Charleston High senior class of 2008 preparing and attending their historic, first integrated prom, in the context of strong emotions, traditions, and conflict inherent in race relations in the community, and in the deep south. Some of the white parents maintained their whites-only prom."
"The War Tapes","Documentary,War","Straight from the front lines in Iraq, THE WAR TAPES is the first war movie filmed by soldiers themselves. These soldiers bypassed Pentagon supervised media to share their experience like never before. Funnier, spicier, and more gut wrenching than news reports, this is Operation Iraqi Freedom as filmed by Sergeant Steve Pink, Sergeant Zack Bazzi and Specialist Mike Moriarty. Steve is a wisecracking carpenter who aspires to be a writer. Zack is a Lebanese-American university student who loves to travel and is fluent in Arabic. Mike is a father who seeks honor and redemption. Each leaves a woman behind - a girlfriend, a mother and a wife. Through their candid footage, these men open their hearts and take us on an unforgettable journey, capturing camaraderie and humor along with the brutal and terrifying experiences they face. These soldiers got the story that 2,700 embedded reporters never could."
"Fade to Black","Documentary","An intimate look at hip-hop artist Shawn Carter, Jay-Z, revealing the multiple Grammy award winning artist as never before, from his background and rise to fame to the recording of his last album. The film chronicles the legendary concert of Jay-Z's performance at Madison Square Garden in November 2003. In an unprecedented event, a hip-hop artist sold out an arena in only two hours. Nearly one year later, fans and artists alike still reflect on this monumental musical night. The event was a spectacular culmination of Jay-Z's recording career prior to his self-proclaimed retirement from solo performing. Yet this one night also defined a musical generation, showcasing the evolution and reach of the world's most popular music genre. Guest performers included Jay-Z's closest friends and music industry colleagues: Beyoncé, Mary J. Blige, Missy Elliott, R. Kelly, Foxy Brown, Pharrell, and Questlove and The Illadelphonics along with appearances by hip hop icons Damon Dash, Rick Rubin, Slick Rick, P. Diddy and many others. Viewers get the rare glimpse of Jay-Z's creative process as he searches for inspiration, poetry, and perfection in his songs. Narrated by Jay-Z, his account of the night takes on reflections of his entire musical career and his journey that led to this one astounding, fabled evening--rightfully called "Fade To Black.""
"And Everything Is Going Fine","Documentary","From the first time he performed Swimming to Cambodia - the one-man account of his experience of making the 1984 film The Killing Fields - Spalding Gray made the art of the monologue his own. Drawing unstintingly on the most intimate aspects of his own life, his shows were vibrant, hilarious and moving. His death came tragically early, in 2004; this compilation of interview and performance footage nails his idiosyncratic and irreplaceable brilliance."
"My Voyage to Italy","Documentary",""I saw these movies. They had a powerful effect on me. You should see them." That's Martin Scorsese's message for this documentary. We meet his family on Elizabeth Street in New York; he's a third generation Italian with Sicilian roots. Starting in 1949, they watched movies on TV as well as in theaters, lots of Italian imports. Scorsese, with his narration giving a personal as well as a public context, shows extended clips of these movies. Films of Rossellini and De Sica fill part one; those of Visconti, Fellini, and Antonioni comprise part two. Scorsese takes time with emotion, style, staging, technique, political context, and cinematic influence. It's his movie family."
"Ecstasy of Order: The Tetris Masters","Documentary","A documentary that captures the greatest world record Tetris players as they prepare for the Classic Tetris World Championship. From the days of Thor Aackerlund and his historic victory at the 1990 Nintendo World Championships, right up to the present and Harry Hong's perfect "Max-Out" score, this documentary expertly chronicles over two decades of Tetris Mastery."
"The Take","Documentary","In suburban Buenos Aires, thirty unemployed auto-parts workers walk into their idle factory, roll out sleeping mats and refuse to leave. All they want is to re-start the silent machines. But this simple act - the take - has the power to turn the globalization debate on its head. Armed only with slingshots and an abiding faith in shop-floor democracy, the workers face off against the bosses, bankers and a whole system that sees their beloved factories as nothing more than scrap metal for sale. With The Take, director Avi Lewis, one of Canada's most outspoken journalists, and writer Naomi Klein, author of the international bestseller No Logo, champion a radical economic manifesto for the 21st century"
"Catching Hell","Documentary,Sport","When Chicagoan Steve Bartman fatefully deflected a foul ball in Game 6 of the 2003 NLCS, the city's long-suffering Cubs fans found someone new to blame for their cursed century without a World Series title. Director Alex Gibney explores the psychology of die-hard sports fans, the frightening phenomenon of scapegoating, and the hysteria that turned mild-mannered Bartman into the most hated man in Chicago."
"Fetishes","Documentary","Nick Broomfield and a documentary crew visit Pandora's Box, an up-scale house of bondage on Manhattan's Fifth Avenue, where clients pay $175 an hour to be subservient to mistresses. Mistresses talk about their craft; a few clients, usually masked, are interviewed as well. Then, the camera watches sessions organized around fetishes: rubber, wrestling, corporal punishment, masochism, and infantilism. Mistress Raven, the owner of Pandora's Box, explains that pain need not be part of the subservient experience: it is, at its root, a transfer of power. After their session has ended, clients talk about how drained, relaxed, relieved, and at peace they are."
"Once in a Lifetime: The Extraordinary Story of the New York Cosmos","Documentary,Sport","A look back at one of the more curious fads in American professional sports, the sudden rise and precipitous fall of the North American Soccer League, spanning its existence 1968-1984, as seen through the experience of its most famous club, the New York Cosmos. The NASL made very little impact in the US, where soccer had virtually no following, until in 1975 the New York Cosmos succeeded in signing the most famous player in the world, Pele. Attendence for Cosmos games exploded, outdrawing even the New York Giants and New York Jets of the NFL, to where exhibition games in Seattle were drawing huge crowds, and when Pele announced his retirement in 1977 his final game drew the biggest crowd to ever see a soccer game in the US. His retirement from the game began a slow but steady decline for the NASL as money issues for the league and the spending practices of the Cosmos became a running controversy."
"Mondovino","Documentary","Explores a thesis: that the deep colored, oak-aged taste of Bordeaux wines has become the world standard, following the writing of critic Robert Parker, the magazine "Wine Spectator," the consulting work of Michel Rolland of Pomerol, and the money of Mondavi, a publicly-traded corporation based in Napa with a family history of wine making. Wine makers worldwide, many using Rolland as a consultant, pursue this structure, color, and taste - to the detriment, argue some, of wine that should reflect the character of the land where the grape is grown, including the lighter Burgundy. A few old wine makers, from Aniane, Sardinia, and Argentina offer this argument."
"Look, Up in the Sky! The Amazing Story of Superman","Documentary,History","In 1938, two aspiring comic strip talents, Jerry Siegal and Joe Shuster, published a character that would create a new genre of fantasy, Superman, the first superhero. This film explores the creation of the character and his subsequent evolution over the decades through various media. With various interviews of noted creative luminaries, the film shows how the character has adapted to the times and bounced back from times when he felt irrelevant to always regain his prominence as one of the great heroes of popular culture."
"8: The Mormon Proposition","Documentary","In 2009, thousands of LGBT citizens are denied almost 200 civil rights their straight, married counterparts enjoy through civil marriage. Some states have signaled progress. But amid the progress, The Mormon Church, with its front-group THE NATIONAL ORGANIZATION FOR MARRIAGE, has been coordinating, financing and leading the effort to stop the advancement of marriage equality for more than three decades. As an organization worth hundreds of billions of dollars, the Mormon Church has been able to wage this war in secret. Not until the California Fair Political Practices Commission launched an investigation into the Mormon's involvement in Proposition 8, did the secrets of the Mormon effort become a matter of record. Through never-before seen documents, recordings & insider-interviews, 8: THE MORMON PROPOSITION, exposes the efforts of the Mormon Church and its members to halt nearly every piece of LGBT legislation on the desks of lawmakers from Hawaii to New York. 8: THE MORMON PROPOSITION makes these efforts a matter of record and challenges viewers to demand more of government officials in requiring religions more transparency in their efforts to influence public policy. Emmy-award winning journalist and documentary filmmaker Reed Cowan is a former Mormon who served a two-year mission door-to-door for the Mormon Church. His access to high-level Mormons & Mormon communications on the matter, coupled with his OUT status as a gay man and father of two adopted sons has provided a compelling and at times shocking look at the Mormon way of doing business against LGBT people."
"Reel Injun","Documentary","A documentary about the evolution of the depiction of First Nations people in film, from the silent era to today. Featuring clips from hundreds of films, candid interviews with famous Native and non-Native directors, writers and actors, Reel Injun traces how the image of First Nations people in cinema have influenced the understanding and misunderstanding of their culture and history."
"That's It, That's All.","Documentary,Adventure,Sport","Dedicated to everything snowboarding, Travis Rice and a dream team crew set out on a seek-and-destroy operation for the new zone, the new trick and the new perspective on the sport. New Zealand, Valdez, B.C., Munich, Tokyo, Jackson Hole and deeper...seen in a new light with action that leaves you wondering, how did they do that? Aspiring to bring you closer, the Hi Def, 35mm, super16 footage answers the question why Trice and his friends have poured blood, sweat, tears and soul into a simple thing like snowboarding. Take a look. That's it. That's all."
"Divine Trash","Documentary","The life and times of Baltimore film maker and midnight movie pioneer, John Waters. Intercut with a 1972 interview of Waters are clips from his first films and recent interviews with his parents, his brother, Divine's mom, actors and crew, other directors, film critics, a film curator, psychologists, and Maryland's last censor, who shudders at the memory of Waters's pictures. Also included is footage of Waters making his early movies, culminating in an up-close and in-depth look at Pink Flamingos: the script, the set, the filming conditions, its editing, its distribution, and its impact. In sweet ways, this documentary is also a celebration of Divine (1945-1988)."
"Unzipped","Documentary","Using a variety of cinematographic techniques, the world of high- profile fashion designer Issac Mizrahi is portrayed as being driven by excitement and creativity, despite the concomitant chaos and cacophony. Mizrahi's frenzied genius and rollercoaster emotions paint a humorous and personal portrait of a brilliant designer. Famous "SuperModels", actors, and actresses populate Issac's rarified world, but Douglas Keeve's cameras capture the stress and turbulence beneath the placid coolness of glamour."
