"American Movie","Documentary","On the northwest side of Milwaukee, Mark Borchardt dreams the American dream: for him, it's making movies. Using relatives, local theater talent, slacker friends, his Mastercard, and $3,000 from his Uncle Bill, Mark strives over three years to finish "Covan," a short horror film. His own personal demons (alcohol, gambling, a dysfunctional family) plague him, but he desperately wants to overcome self-doubt and avoid failure. In moments of reflection, Mark sees his story as quintessentially American, and its the nature and nuance of his dream that this film explores."
"The Interrupters","Documentary,Crime","The Interrupters tells the moving and surprising stories of three Violence Interrupters who try to protect their Chicago communities from the violence they once employed. From acclaimed director Steve James and bestselling author Alex Kotlowitz, this film is an unusually intimate journey into the stubborn, persistence of violence in our cities. Shot over the course of a year out of Kartemquin Films, The Interrupters captures a period in Chicago when it became a national symbol for the violence in our cities. During that period, the city was besieged by high-profile incidents, most notably the brutal beating of Derrion Albert, a Chicago High School student, whose death was caught on videotape. The film's main subjects work for an innovative organization, CeaseFire, which believes that the spread of violence mimics the spread of infectious diseases, and so the treatment should be similar: go after the most infected, and stop the infection at its source. The singular mission of the "Violence Interrupters" - who have credibility on the streets because of their own personal histories -- is to intervene in conflicts before they explode into violence. In The Interrupters, Ameena Matthews, whose father is Jeff Fort, one of the city's most notorious gang leaders, was herself a drug ring enforcer. But having children and finding solace in her Muslim faith pulled her off the streets and grounded her. In the wake of Derrion Albert's death, Ameena becomes a close confidante to his mother, and helps her through her grieving. Ameena, who is known among her colleagues for her fearlessness, befriends a feisty teenaged girl who reminds her of herself at that age. The film follows that friendship over the course of many months, as Ameena tries to nudge the troubled girl in the right direction. Cobe Williams, scarred by his father's murder, was in and out of prison, until he had had enough. His family - particularly a young son - helped him find his footing. Cobe disarms others with his humor and his general good nature. His most challenging moment comes when he has to confront a man so bent on revenge that Cobe has to pat him down to make sure he's put away his gun. Like Ameena, he gets deeply involved in the lives of those he encounters, including a teenaged boy just out of prison and a young man from his old neighborhood who's squatting in a foreclosed home. Eddie Bocanegra is haunted by a murder he committed when he was seventeen. His CeaseFire work is a part of his repentance for what he did. Eddie is most deeply disturbed by the aftereffects of the violence on children, and so he spends much of his time working with younger kids in an effort to both keep them off the streets and to get support to those who need it - including a 16-year-old girl whose brother died in her arms. Soulful and empathic, Eddie, who learned to paint in prison, teaches art to children, trying to warn them of the debilitating trauma experienced by those touched by the violence. The Interrupters follows Ameena, Cobe and Eddie as they go about their work, and while doing so reveals their own inspired journeys of hope and redemption. The film attempts to make sense of what CeaseFire's Tio Hardiman calls, simply, "the madness"."
"The Wild and Wonderful Whites of West Virginia","Documentary","Shoot-outs, robberies, gas-huffing , drug dealing, pill popping, murders, and tap dancing - what do these all have in common? These are just a few of the parts of being a member of the Wild and Wonderful White Family. The legendary family is as known for their wild, excessive criminal ways as they are for their famous mountain dancing members, including Jesco White, the star of the cult classic documentary "Dancing Outlaw." Exploring both the comic and tragic sides of life on the other side of the law, this stylish, fast-paced family portrait exposes the powerful forces of corruption, poverty, and West Virginia's environmentally and culturally devastating coal mining culture that helped shape the White family, a dying breed of outlaws preserving a dying form of dance."
"DMT: The Spirit Molecule","Documentary","The Spirit Molecule investigates dimethyltryptamine (DMT), an endogenous psychoactive compound, which exists in humans and numerous species of plants and animals. The documentary traces Dr. Rick Strassman's government-sanctioned, human DMT research and its many trials, tribulations, and inconceivable realizations. A closer examination of DMT's effects through the lens of two traditionally opposed concepts, science and spirituality, The Spirit Molecule explores the connections between cutting-edge neuroscience, quantum physics, and human spirituality. Strassman's research, and the experiences of the human test subjects before, during, and after the intense clinical trials, raises many intriguing questions. A variety of experts voice their unique thoughts and experiences with DMT within their respective fields. As Strassman's story unfolds, the contributors weigh in on his remarkable theories, including the synthesis of DMT in our brain's pineal gland, its link to near-death & alien-abduction experiences, the history/future of psychedelics, and the uncanny likeness to ancient religious texts describing prophets with DMT-like experiences. Additionally, the intriguing similarities to the "many-worlds" interpretation of quantum mechanics lead to other fascinating discoveries. The experts offer a comprehensive collection of information, opinions, and speculation to help understand the nature of the DMT experience, and its role in human culture and the life force of our planet. Due to the profound nature, and visual phantasmagoria, of the DMT experience, the visual landscape of the film features stunning visualizations from Scott Draves (Electric Sheep), as well as a cutting-edge motion graphics, which demonstrate DMT's conceptual link to human evolution, construction of the universe, advanced neuroscience, and other alluring theories. Finally, stylized scenes reminiscent of Rod Sterling's famous Twilight Zone bookends, Joe Rogan (actor/comedian) serves as tour guide, helping navigate the expansive realms of Strassman's DMT universe. Dimethyltryptamine: a simple molecule with enormous implications. The Spirit Molecule's subtle combination of science, spirituality, and philosophy results in an abundance of incredible ideas and theories that could alter the way we understand the universe and our relationship to it."
"Startup.com","Documentary","Kaleil Isaza Tuzman and Tom Herman have had a dream since they became friends at age fifteen: get rich by developing their own dot com company, in some aspect of computer technology interface. Now in their late twenties, they have now come up with the idea they believe will make their riches, namely as Tom refers to it, "parking tickets": the company will be the on-line revenue collection interface for municipal governments. GovWorks.com came into existence in May 1999 with only an idea. The process of building the business focuses on obtaining venture capital based solely on the idea, with the actual mechanics of the website seemingly almost an afterthought, or at least one left primarily to the hired help. Regardless of the strength of the idea itself in raising this capital, another initial problem they face is what they see as non-commitment by a third partner, Kaleil's friend Chieh Cheung. In early 2000, they do manage to go live with their product to what seems to be a promising and lucrative future. However, the success of the business is fraught with many obstacles including the competition who may have a better product or one introduced in the marketplace earlier, the whims of the economy especially as it concerns the equity market, and the fact that the business has few assets beyond intellectual capital. In addition, their personal focus is solely on the business which places a strain on their personal relationships, Tom's with his young daughter Tia Herman, and Kaleil's with his girlfriend Dora Glottman. Their relationship with each other is also tested as it is and always was an inequitable one - Kaleil being the self-admitted alpha dog - and one which may be usurped by business concerns."
"Fastest","Documentary,Action,Sport","Shot around the world in 2010 and 2011 and narrated by Ewan McGregor, 'Fastest' captures the intense and thrilling reality of the MotoGP World Championship, documenting a pivotal moment in the sport. With Valentino Rossi chasing his tenth World Championship title the Italian ran into one of the toughest challenges of his career: a crop of exceptionally fast young competitors, a horrific leg break at his home race, and an amazing comeback little over 40 days later. Confronting such a monumental task and with rival Jorge Lorenzo taking the 2010 title, Rossi faced up to one of the most testing year's in his illustrious career and along with his fellow competitors was left asking: Who is the fastest rider now?"
"Four Horsemen","Documentary,Animation,News","The modern day Four Horsemen continue to ride roughshod over the people who can least afford it. Crises are converging when governments, religion and mainstream economists have stalled. 23 international thinkers come together and break their silence about how the world really works and why there is still hope in re-establishing a moral and just society. Four Horsemen is free from mainstream media propaganda, doesn't bash bankers, criticize politicians or get involved in conspiracy theories. The film ignites the debate about how we usher a new economic paradigm into the world which, globally, would dramatically improve the quality of life for billions."
"The Endless Summer","Documentary,Sport","They call it The Endless Summer the ultimate surfing adventure, crossing the globe in search of the perfect wave. From the uncharted waters of West Africa, to the shark-filled seas of Australia, to the tropical paradise of Tahiti and beyond, these California surfers accomplish in a few months what most people never do in a lifetime...They live their dream. Director Bruce Brown creates a film so powerful it has become a timeless masterpiece that continues to capture the imagination of every new generation. When it first played in theaters, audiences lined up to see it again and again, spellbound by its thrilling excitement and awesome photography. But in fact, what's most compelling about the film is the sport of surfing itself, and once you've seen it, you'll never forget why."
"Paris Is Burning","Documentary","An unblinking behind the scenes story of fashion obsessed New Yorkers who created "voguing" and drag balls , and turned these raucous celebrations into a powerful expression pf personal pride. The world within a world is instantly familiar, filled with ambitions, desires and yearnings that reflect America itself. PARIS IS BURNING is an intimate portrait of one urban community, a world in which the allure of high fashion, status and wealth becomes an affirmation of love, acceptance and joy."
"The September Issue","Documentary","An impressive documentary following editor-in-chief Anna Wintour & her team as they struggle to write Vogue's largest and heaviest number of all times (840 pages and almost 5 pounds). The viewer observes the complicated process through which everyone goes through while working for a fashion magazine. Viewers can also admire Grace Coddington, a former model that became a creative director after a car accident, while she passionately helps the magazine evolve and even stand up to some of Anna Wintour's ideas."
"The Business of Being Born","Documentary","Birth: it's a miracle. A rite of passage. A natural part of life. But more than anything, birth is a business. Compelled to find answers after a disappointing birth experience with her first child, actress Ricki Lake recruits filmmaker Abby Epstein to explore the maternity care system in America. Focusing on New York City, the film reveals that there is much to distrust behind hospital doors and follows several couples who decide to give birth on their own terms. There is an unexpected turn when director Epstein not only discovers she is pregnant, but finds the life of her child on the line. Should most births should be viewed as a natural life process, or should every delivery be treated as a potential medical emergency?"
"Like Water","Documentary","Anderson Silva is the deadliest man on the planet - The longest-reigning UFC Champion, and the most feared fighter in mixed martial arts. Like Water offers a unique perspective of the living legend as he trains with fellow fighters Lyoto "The Dragon" Machida, Junior Dos Santos, and Antonio "Minotauro" Nogueira, in preparation for his career defining title defense against challenger, and arch villain Chael Sonnen. Sonnen, a former champion wrestler, has many predicting that he is the one fighter who possesses the skill set required to defeat Silva. A man of few words, Anderson Silva walks the fine line between cockiness and confidence. A philosopher in spirit, and dedicated family man, Silva's personality contradicts that of Sonnen's, who uses trash talk and intimidation to get under his opponents' skin. Balancing family and fighting; respect for the sport, and rage for his opponent; Silva's mind and body will be put to the test, as first-time filmmaker Pablo Croce peels back the layers of an ultimate fighter to reveal the heart of a champion."
"Dear America: Letters Home from Vietnam","Documentary,History,War","Feature-length documentary film featuring real-life letters written by American soldiers, sailors, airmen, and Marines during the Vietnam War to their families and friends back home. Archive footage of the war and news coverage thereof augment the first-person "narrative" by men and women who were in the war, some of whom did not survive it."
"My Date with Drew","Documentary",""If you don't take risks, you'll have a wasted soul." - Drew Barrymore. Ever since the second grade when he first saw her in E.T. The Extraterrestrial, Brian Herzlinger has had a crush on Drew Barrymore. Now, 20 years later he's decided to try to fulfill his lifelong dream by asking her for a date. There's one small problem: She's Drew Barrymore and he's, well, Brian Herzlinger, a broke 27-year-old aspiring filmmaker from New Jersey. But that doesn't stop Brian and his film school pals from doing everything they can think of to convince Barrymore to go out with him - and documenting their quest along the way. Equipped with a video camera they have to return to Circuit City in 30 days and the $1,100 Brian won on a game show (where the winning answer was, prophetically, "Drew Barrymore"), they've got one month to accomplish their mission. To succeed, they'll need to negotiate an army of publicists, agents, producers and assistants who surround the star so Brian can pop the question. My Date with Drew is the award-winning, inspirational story of an ordinary guy who, despite incredibly long odds, puts everything on the line to pursue his lifelong dream. It's also an astute and often hilarious look at contemporary dating rituals, the culture of celebrity and the power of passion."
"Salesman","Documentary","Filmmakers (and brothers) Albert and David Maysles follow four employees of a company that makes expensive, ornate, illustrated bibles as they attempt to sell the items door-to-door to less-than-interested customers, who are mainly poor or lower-middle-class Catholics with little money to spend on pretty Bibles."
"A Haunting in Connecticut","Documentary,Horror","The day Karen and Ed Parker move into their dream home, ominous clues of its chilling funeral parlor past greet them: crucifixes on doors, toe tags and coffin keys in the basement. Their 14-year-old son, Paul, claims he sees apparitions and hears voices. Soon, the house is plagued by dark forces that torment the entire family, and it will take a desperate call to Edward and Lorraine Warren-investigators of the Amityville haunting-to offer any hope of relief."
"For the Bible Tells Me So","Documentary","We meet five Christian families, each with a gay or lesbian child. Parents talk about their marriages and church-going, their children's childhood and coming out, their reactions, and changes over time. The stories told by these nine parents and four adult children alternate with talking heads - Protestant and Jewish theologians - and with film clips of fundamentalist preachers and pundits and news clips of people in the street. They discuss scripture and biblical scholarship. A thesis of the film is that much of Christianity's homophobia represents a misreading of scripture, a denial of science, and an embrace of quack psychology. The families call for love."
"Are All Men Pedophiles?","Documentary","For the first time in history the tables have turned on men. In the past "Witch-Hunt" was associated with women but now it is associated with men. In an effort to protect our children society has started to isolate men. This documentary explores the pedophilia hysteria and how all men are viewed as potential pedophiles. How did society come to such a conclusion and what are the political and social consequences? Have men really become victims of modern sexism or is the increase in sexism justified? Are All Men Pedophiles?"
"Body of War","Documentary,War","Body of War is a documentary following Tomas Young, an Iraq War veteran paralyzed from a bullet to the spine, on a physical and emotional journey as he adapts to his new body and begins to question the decision to go to war in Iraq. From soldier to anti-war activist, the film takes an unflinching view of the physical and emotional aftermath of war through the eyes of an American hero. The film unfolds on two parallel tracks. On the one hand, we see Tomas evolving into a powerful voice against the war as he struggles to deal with the complexities of a paralyzed body. And on the other hand, we see the historic debate unfolding in the Congress about going to war in Iraq."
"The End of America","Documentary","The End of America details the ten steps a country takes when it slides toward fascism. It's not a "lefty"tot tome, rather a historical look at trends in once-functioning democracies from modern history that are being repeated in our country today. It gives any reader (or viewer of the lecture) a much-needed history lesson and constitutional refresher. Most importantly, it puts the recent gradual loss of civil liberties in the U.S. in a historical context. The average American might not be alarmed at AT&T; selling our private information to the Bush administration, but when this action is seen as part of a larger series of erosions and events, a pattern emerges with unfortunate consequences that become disturbingly clear."
"Paradise Lost 2: Revelations","Documentary","In 1994, three nonconformist boys in West Memphis, Arkansas were convicted for a horrific triple child murder. However, the original film shows how questionable evidence and a prejudiced community instead led to an apparent miscarriage of justice. The producers return to West Memphis to meet the Three again and the grassroots movement that has arisen to exonerate the Three. However, the father of one of the victims, John Mark Byers, is profiled as well as he belligerently asserts the three's guilt even as new evidence and his own criminal record draws suspicion on himself."
"Children Underground","Documentary","One of the most astonishing and engaging cinematic works of the past decade, CHILDREN UNDERGROUND is a profoundly intimate and heart-wrenching drama about homeless children struggling for survival on the streets and in the subways of Bucharest, Romania."
"Which Way Home","Documentary",""Which Way Home" is a feature documentary film that follows unaccompanied child migrants, on their journey through Mexico, as they try to reach the United States. We follow children like Olga and Freddy, nine-year old Hondurans, who are desperately trying to reach their parents in the US.; children like Jose, a ten-year old El Salvadoran, who has been abandoned by smugglers and ends up alone in a Mexican detention center; and Kevin, a canny, streetwise fourteen-year old Honduran, whose mother hopes that he will reach the U.S. and send money back to her. These are stories of hope and courage, disappointment and sorrow. They are the children you never hear about; the invisible ones."
"Mondo cane","Documentary","Nominally a documentary, this film combines a number of unrelated sequences (both real and staged) -- including a South Pacific "cargo cult", the ritual slaughter of a bull, tribal dances and rituals, and a visit to an ornate pet cemetery -- all focused on the lurid, sensational, and eccentric."
"Crude","Documentary","One of the largest and most controversial legal cases on the planet. An inside look at the infamous $27 billion "Amazon Chernobyl" case, CRUDE is a real-life high stakes legal drama set against a backdrop of the environmental movement, global politics, celebrity activism, human rights advocacy, the media, multinational corporate power, and rapidly-disappearing indigenous cultures. Presenting a complex situation from multiple viewpoints, the film examines a complicated situation from several angles while bringing a story of environmental peril and human suffering into focus."
"Harlan County U.S.A.","Documentary","This film documents the coal miners' strike against the Brookside Mine of the Eastover Mining Company in Harlan County, Kentucky in June, 1973. Eastovers refusal to sign a contract (when the miners joined with the United Mine Workers of America) led to the strike, which lasted more than a year and included violent battles between gun-toting company thugs/scabs and the picketing miners and their supportive women-folk. Director Barbara Kopple puts the strike into perspective by giving us some background on the historical plight of the miners and some history of the UMWA."
"Vanishing of the Bees","Documentary,History","This documentary takes a piercing investigative look at the economic, political and ecological implications of the worldwide disappearance of the honeybee. The film examines our current agricultural landscape and celebrates the ancient and sacred connection between man and the honeybee. The story highlights the positive changes that have resulted due to the tragic phenomenon known as "Colony Collapse Disorder." To empower the audience, the documentary provides viewers with tangible solutions they can apply to their everyday lives. Vanishing of the Bees unfolds as a dramatic tale of science and mystery, illuminating this extraordinary crisis and its greater meaning about the relationship between humankind and Mother Earth. The bees have a message - but will we listen?"
"The Last Days","Documentary,War","Five Jewish Hungarians, now U.S. citizens, tell their stories: before March, 1944, when Nazis began to exterminate Hungarian Jews, months in concentration camps, and visiting childhood homes more than 50 years later. An historian, a Sonderkommando, a doctor who experimented on Auschwitz prisoners, and US soldiers who were part of the liberation in April, 1945, also comment. Most telling are details: Renée packing her bathing suit, Irene swallowing the diamonds her mother gave her to buy bread, Alice's memorial for her sister Klara, Bill escaping police by jumping into a line of Jews going to Buchenwald, and Tom told by a US soldier to have "all the damn bananas and oranges you can eat.""
"Chariots of the Gods","Documentary","Documentary based on the book by Erich Von Daniken concerning the ancient mysteries of the world, such as the pyramids of Egypt and Mexico, ancient cave drawings, the monuments of Easter Island, etc. and the fact that these things and modern civilization could have been influenced by extra-terrestrial visitations hundreds(or perhaps thousands) of years ago."
"Klitschko","Documentary,Biography,Sport","A documentary encompassing the lives of world heavyweight boxing champions, Vitali & Wladimir Klitschko. The first time in history two brothers have shared all the heavyweight world titles, this film explores their humble beginnings in the Ukraine to their rise to stardom and domination of heavyweight prize fighting."
"180° South","Documentary,Drama,Sport","Conquerors of the Useless follows Jeff Johnson as he retraces the epic 1968 journey of his heroes Yvon Chouinard and Doug Tompkins to Patagonia. Along the way he gets shipwrecked off Easter Island, surfs the longest wave of his life - and prepares himself for a rare ascent of Cerro Corcovado. Jeff's life turns when he meets up in a rainy hut with Chouinard and Tompkins who, once driven purely by a love of climbing and surfing, now value above all the experience of raw nature - and have come to Patagonia to spend their fortunes to protect it."
