"Rambo","Action,Thriller,War","Vietnam veteran John Rambo has survived many harrowing ordeals in his lifetime and has since withdrawn into a simple and secluded existence in Thailand, where he spends his time capturing snakes for local entertainers, and chauffeuring locals in his old PT boat. Even though he is looking to avoid trouble, trouble has a way of finding him: a group of Christian human rights missionaries, led by Michael Burnett and Sarah Miller, approach Rambo with the desire to rent his boat to travel up the river to Burma. For over fifty years, Burma has been a war zone. The Karen people of the region, who consist of peasants and farmers, have endured brutally oppressive rule from the murderous Burmese military and have been struggling for survival every single day. After some inner contemplation, Rambo accepts the offer and takes Michael, Sarah, and the rest of the missionaries up the river. When the missionaries finally arrive at the Karen village, they find themselves part of a raid by the sadistic Major Pa Tee Tint and a slew of Burmese army men. A portion of the villagers and missionaries are tortured and viciously murdered, while Tint and his men hold the remainder captive. Concerned by their disappearance, the minister in charge of the mission gathers a group of mercenaries and pleas Rambo transport them with his boat, since he knows their last exact location. But Rambo can't stay behind: he joins the team where he belongs, to liberate the survivors from the clutches of Major Tint in what may be one of his deadliest missions ever"
"Master and Commander: The Far Side of the World","Action,Adventure,Drama","During the Napoleonic Wars, a British frigate, HMS Surprise, and a much larger French warship, the Acheron, with greater fire power, stalk each other off of the coast of South America. Russell Crowe brings great intensity to the role of Captain Jack Aubrey. Lucky Jack, as he is referred to by his crew, is well regarded by his men, who trust him implicitly, even after the first devastating battle and an apparent personal vendetta against the French captain. While the naval battle sequences are quite fantastic, the film is successful because director Weir chose to build the story to get to know the men who are locked aboard the tight quarters of a small ship and how they interact everyday. The officers and the mates are well-known by the time the final battle comes. Paul Bettany offers a strong performance as the surgeon and naturalist who balances the violence of his chosen life with the quiet demeanor of the scientist. He is the captain's friend and confidant, the two frequently playing violin and cello duets together. The horrors of the injuries from the war are frequently implied, but vividly depicted in the reactions of the characters."
"Enemy at the Gates","Drama,History,Thriller","In World War II, the fall of Stalingrad will mean the collapse of the whole country. The Germans and Russians are fighting over every block, leaving only ruins behind. The Russian sniper Vassili Zaitsev stalks the Germans, taking them out one by one, thus hurting the morale of the German troops. The political officer Danilov leads him on, publishing his efforts to give his countrymen some hope. But Vassili eventually start to feel that he can not live up to the expectations on him. He and Danilov fall in love with the same girl, Tanya, a female soldier. From Germany comes the master sniper König to put an end to the extraordinary skilled Russian sniper."
"Lawrence of Arabia","Adventure,Biography,Drama","An inordinately complex man who has been labeled everything from hero, to charlatan, to sadist, Thomas Edward Lawrence blazed his way to glory in the Arabian desert, then sought anonymity as a common soldier under an assumed name. The story opens with the death of Lawrence in a motorcycle accident in Dorset at the age of 46, then flashbacks to recount his adventures: as a young intelligence officer in Cairo in 1916, he is given leave to investigate the progress of the Arab revolt against the Turks in World War I. In the desert, he organizes a guerrilla army and--for two years--leads the Arabs in harassing the Turks with desert raids, train-wrecking and camel attacks. Eventually, he leads his army northward and helps a British General destroy the power of the Ottoman Empire."
"Valkyrie","Drama,History,Thriller","In Nazi Germany during World War II, as the tide turned in favor of The Allies, a cadre of senior German officers and politicians desperately plot to topple the Nazi regime before the nation is crushed in a near-inevitable defeat. To this end, Colonel Claus von Stauffenberg, an Army officer convinced he must save Germany from Hitler, is recruited to mastermind a real plan. To do so, he arranges for the internal emergency measure, Operation: Valkyrie, to be changed to enable his fellows to seize control of Berlin after the assassination of the Fuhrer. However, even as the plan is put into action, a combination of bad luck and human failings conspire on their own to create a tragedy that would prolong the greater one gripping Europe."
"Lincoln","Biography,Drama,History","It's January, 1865, and US President Abraham Lincoln has just started his second term in office as an immensely popular leader, especially among his supporters, because of his down home attitude. However, the country is in turmoil with the Civil War entering its fourth year and having taken the lives of many a soldier on both sides. Lincoln believes that passage of the Thirteenth Amendment to the Constitution - which would abolish slavery - would most importantly achieve something in which he believes to his core, but also end the war as slavery is a large part of the raison d'etre for it. The Amendment has already passed in the Senate, and is scheduled for vote in the House of Representatives at the end of the month. While he is assured of yes votes from his fellow Republicans, he and his team have to work hard behind the scenes to assure enough yes votes from Democrats, which may require some compromise in other areas. But other factors may also come into play on the vote, such as the Confederate forces in the war issuing their own compromise to end the war but keep slavery. Meanwhile, Lincoln also deals with his oft supportive but oft tumultuous relationship with wife Mary Todd Lincoln, and their latest possible rift in oldest son, Robert Todd Lincoln's want to leave law school to enlist."
"Das Boot","Action,Adventure,Drama","It is 1942 and the German submarine fleet is heavily engaged in the so called "Battle of the Atlantic" to harass and destroy British shipping. With better escorts of the Destroyer Class, however, German U-Boats have begun to take heavy losses. "Das Boot" is the story of one such U-Boat crew, with the film examining how these submariners maintained their professionalism as soldiers, attempted to accomplish impossible missions, while all the time attempting to understand and obey the ideology of the government under which they served."
"The Great Escape","Adventure,Drama,History","In 1942, the Germans have built what they consider an escape-proof POW camp where they plan to house all the problem POWs, i.e. those that have made multiple escape attempts in the past. What the Germans don't realize is that they've put all the best escape minds in one location. If they can't escape, these POWs believe it is their military duty to make the enemy place as much effort into their confinement as possible to divert them from other war related pursuits. Royal Air Force Squadron Leader Bartlett plans not just a one or two man escape at a time like most escape attempts in the past have been, but a massive escape of two hundred fifty men through a series of tunnels - if one tunnel is found, they can focus on the others. Each escapee will be provided with a complete set of forged documents and standard clothing. With their reputations preceding them, each POW is assigned a specific task in carrying out the plan. Somewhat outside of the plot are Captain Hilts and Flying Officer Ives - who spent their first thirty days in camp in the cooler together - they who are unofficially assigned as the decoys who will make more rudimentary escape attempts. They ask Hilts to make a more serious task of reconnaissance of the local town if he ever does successfully escape, which of course means his recapture to bring the information back into camp and more time in the cooler. Beyond basic logistical problems and the Germans finding out what's going on, they have potential problems in certain POWs who may become liabilities dealing with their own personal issues."
"Three Kings","Action,Adventure,Comedy","In the days immediately after the Gulf War, a group of American soldiers come across a secret Iraqi map, which discloses the whereabouts of a bunker where Iraq is storing stolen gold and treasure from Kuwait. The soldiers hope to take the gold and keep it for themselves. However, when they arrive at the site, they discover that the Iraqi army is more concerned about persecuting its civilians than stopping them from stealing the gold. They learn that the civilians have been encouraged by the U.S. government to rise up and fight Sadaam Hussein, but are facing certain execution because the U.S. military refuses to help them. This incident creates a crisis of conscience for the American soldiers. Do they take the money and run, leaving the civilians to face certain death at the hands of the Iraqi army? Or do they risk losing the gold in order to escort them to safety across the border into Iran?"
"Jarhead","Biography,Drama,War","Jarhead (the self-imposed moniker of the Marines) follows "Swoff," a third-generation enlistee, from a sobering stint in boot camp to active duty, sporting a sniper's rifle and a hundred-pound ruck on his back through Middle East deserts with no cover from intolerable heat or from Iraqi soldiers, always potentially just over the next horizon. Swoff and his fellow Marines sustain themselves with sardonic humanity and wicked comedy on blazing desert fields in a country they don't understand against an enemy they can't see for a cause they don't fully fathom... Sergeant Sykes is a Marine lifer who heads up Swofford's scout/sniper platoon, while Troy is Swoff's friend and mentor, a die-hard member of STA - their elite Marine Unit."
"The Thin Red Line","Drama,War","In World War II, the outcome of the battle of Guadalcanal will strongly influence the Japanese advance into the Pacific theater. A group of young soldiers is brought in as a relief for the battle-weary Marines. The exhausting fight for a strategically-positioned airfield that allows control over a 1000-mile radius puts the men of the Army rifle company C-for-Charlie through hell. The horrors of war form the soldiers into a tight-knit group; their emotions develop into bonds of love and even family. The reasons for this war get further away as the world for the men gets smaller and smaller until their fighting is for mere survival and the life of the other men with them."
"Alexander","Action,Adventure,Biography","Conquering 90% of the known world by the age of 25, Alexander the Great led his armies through 22,000 miles of sieges and conquests in just eight years. Coming out of tiny Macedonia, Alexander led his armies against the mighty Persian Empire, drove west to Egypt, and finally made his way east to India. This film will concentrate on those eight years of battles, as well as his relationship with his boyhood friend and battle mate, Hephaestion. Alexander died young, of illness, at 33. Alexander's conquests paved the way for the spread of Greek culture (facilitating the spread of Christianity centuries later), and removed many of the obstacles that might have prevented the expansion of the Roman Empire. In other words, the world we know today might never have been if not for Alexander's bloody, yet unifying, conquest."
"Letters from Iwo Jima","Drama,History,War","The island of Iwo Jima stands between the American military force and the home islands of Japan. Therefore the Imperial Japanese Army is desperate to prevent it from falling into American hands and providing a launching point for an invasion of Japan. General Tadamichi Kuribayashi is given command of the forces on the island and sets out to prepare for the imminent attack. General Kuribayashi, however, does not favor the rigid traditional approach recommended by his subordinates, and resentment and resistance fester among his staff. In the lower echelons, a young soldier, Saigo, a poor baker in civilian life, strives with his friends to survive the harsh regime of the Japanese army itself, all the while knowing that a fierce battle looms. When the American invasion begins, both Kuribayashi and Saigo find strength, honor, courage, and horrors beyond imagination."
"The English Patient","Drama,Romance,War","A burn victim, a nurse, a thief, and a sapper find themselves in each others company in an old Italian villa close to the end of World War II. Through flashbacks, we see the life of the burn victim, whose passionate love of a woman and choices he made for her ultimately change the lives of one other person in the villa. Not only is this film a search for the identity of the English patient, but a search for the identities of all the people in the quiet old villa."
"The Bridge on the River Kwai","Adventure,Drama,War","During WWII, the Japanese have set up a POW camp in Indochina on an island on the banks of the Kwai River. The primary purpose of this location is so that the Japanese can use the labor of the POWs to construct a railway bridge over the river, the bridge which will be a vital link for the Japanese forces in the war. It needs to be completed in five month's time. The camp is presided over by Colonel Saito, a man ruled by a mixture of Japanese cultural tradition and the need to win the war at any cost, even if it includes torture and other measures against the Geneva Convention. Among the officers at the camp are Colonel Nicholson, the senior British officer for who the principle of the matter is foremost regardless of the consequences; Major Clipton, the pragmatic medical officer; and US Navy Commander Shears who is more concerned about his own well being and that of those around him than he is about the big picture of the war. Against the assertions of its futility by both Saito and Nicholson, three POWs try to escape - among them being Shears - with all being shot. Everyone believes Shears is dead, but he manages to survive and make it out of the jungle back to safety. At the camp, a battle of wills ensues between Nicholson and Saito, specifically regarding the illegal use of POW officers as laborers to build the bridge. Nicholson wins the respect of the POWs because of this standoff. But Nicholson ultimately has other thoughts, namely taking control of the building of a proper, well made bridge to replace the haphazard one currently being directed by Saito. Nicholson's rationale is that it will raise the morale of the POWs by giving them something constructive to do, while demoralizing the enemy by showing them the superiority of the British. Meanwhile, as Shears is convalescing at a beach-side military hospital in Ceylon, he is certain he will get his wish of a medical discharge. His plans are disrailed when he is asked to participate in a British led four man commando mission to destroy the bridge under the command of Major Warden, the antithesis of Shears in that he can only see the big picture without seeing the personal cost to those around him. This offer is one that Shears cannot refuse. The four understand the risks - the perils of the jungle and the Japanese - but they may not fully realize that their biggest threat for carrying out the mission successfully is Nicholson's pride."
"King Arthur","Action,Adventure,Drama","This original portrayal of "Arthur", as opposed to the mystical elements of the tale in past Arthur films, uses names and other elements from the traditional, medieval, Catholic Arthurian cycle in a very different, yet historically less implausible, almost realistic plot. Around 400 AD, the Roman empire, stretched across many nations, from Arabia to Britain, collapsed and skirmishes over power broke out in outlying countries. The conquering Romans become impressed with the weaponry and fighting skills of the warrior Sarmatian people, which have to send their sons to serve Rome fifteen years in the cavalry before these knights may return home. Arthur is Artorius Castus, whose future Knights of the Round Table, eager to achieve their freedom, are charged by bishop Germanius with one final task before their discharge: a Roman estate tyrant and his family, especially adolescent son Alecto, who is selected for a great future in Rome, must be rescued thereto from the invading Saxons, whose ruthless warrior-king orders his conquering tribal army to pillage and burn entire villages down. But there is another danger lurking on the road to freedom - the Woads, Celtic Britton rebels who hate the Romans, lead by the 'magician' Merlin, who however realizes Rome is no longer the main threat and offers Artorius a novel alliance after sparing his life in an ambush."
"Cold Mountain","Drama,Romance,War",""Cold Mountain" tells the story of a wounded Confederate soldier named Inman who struggles on a perilous journey to get back home to Cold Mountain, N.C. as well as to Ada, the woman he left behind before going off to fight in the Civil War. Along the way, he meets a long line of interesting and colorful characters, while back at home, Ada is learning the ropes of managing her deceased father's farm with Ruby, a scrappy drifter who assists and teaches Ada along the way."
"Defiance","Action,Drama,History","In 1941, in Belorussia, the Jewish Bielski brothers succeed in escaping from the massacre of the German in their village where their parents were killed. They hide in the woods and sooner other runaway Jews join them. Tuvia Bielski, the eldest brother, assumes the leadership of the survivors and plans a camp with tasks for everyone in the community; however, his brother Zus Bielski wants to fight against the Germans and does not agree with Tuvia's directions. Zus decides to join the Russian resistance that believes that Jews do not fight. While Tuvia welcomes any survivor in his camp with his two younger brothers and fight for food and ammunition, Zus finds anti-Semitism among the Russian partisans."
"The Men Who Stare at Goats","Comedy,War","A reporter, trying to lose himself in the romance of war after his marriage fails, gets more than he bargains for when he meets a special forces agent who reveals the existence of a secret, psychic military unit whose goal is to end war as we know it. The founder of the unit has gone missing and the trail leads to another psychic soldier who has distorted the mission to serve his own ends."
"Green Zone","Action,Drama,Thriller","Following the American invasion of Iraq in 2003 Chief Warrant Officer Roy Miller and his men are charged with finding the so-called weapons of mass destruction, whose existence justified American involvement, according to the Pentagon and their man in Baghdad, Poundstone. Veteran CIA operative Marty tells Miller that there are no weapons, it is a deception to allow the Americans to take over the country and install a puppet leader. Also suspicious of Poundstone is Wall Street Journal reporter Lawrie Dayne, who lets slip to Miller that Poundstone told her he had secret talks in Jordan with an important Iraqi, code-named Magellan, who told him about the weapons, though it now seems likely Magellan's true information was to the contrary. So begins a hunt for the truth. Who's playing whom?"
"The Last of the Mohicans","Action,Adventure,Drama","British and French troops do battle in colonial America, with aid from various native American war parties. The British troops enlist the help of local colonial militia men, who are reluctant to leave their homes undefended. A budding romance between a British officer's daughter and an independent man who was reared as a Mohican complicates things for the British officer, as the adopted Mohican pursues his own agenda despite the wrath of different people on both sides of the conflict."
"Glory","Drama,History,War","Shaw was an officer in the Federal Army during the American Civil War who volunteered to lead the first company of black soldiers. Shaw was forced to deal with the prejudices of both the enemy (who had orders to kill commanding officers of blacks), and of his own fellow officers."
"Rambo: First Blood Part II","Action,War","John Rambo who is now in prison after the ruckus he caused in the previous movie, is approached by his former superior, Colonel Trautman. It seems that the government's looking for American MIA's in Vietnam, that are still being held there. Now the man in charge of the mission, Murdock, tells Rambo that his job is to go in, confirm their presence by taking photographs. Rambo senses that Murdock is not what he seems. Rambo goes in takes the photographs, but also takes one of the prisoners with him. When Murdock learns of this, he orders the chopper that's suppose to pick him up to pull out. Rambo is then captured. Obviously Murdock's desire was not to find anyone. Trautman warns him that Rambo's going to come after him. And that's what Rambo's going to do but first he is going after the Vietnamese and Russians, who brutalized him."
"Australia","Adventure,Drama,History","In 1939, the aristocratic Lady Sarah Ashley travels from Great Britain to Australia to meet her husband Maitland Ashley in northern Australia. The husband's drover comes to the city of Darwin to bring Sarah to their farm; however, when they reach Faraway Downs Farm, they find that Maitland was murdered. Sarah befriends Nullah, who tells her that the administrator Neil Fletcher is stealing her cattle; has killed her husband; and is working for the cattle baron King Carney. Sarah fires Fletcher and his men and together with Drover, Nullah and a group of loyal employees, they ride together to take the cattle to supply the army and win a tender in times of war. But the ambitious Fletcher has other intentions and uses Nullah to press Sarah."
"War Horse","Drama,War","Dartmoor,1914: To his wife's dismay farmer Narracott buys a thoroughbred horse rather than a plough animal, but when his teenaged son Albert trains the horse and calls him Joey, the two becoming inseparable. When his harvest fails, the farmer has to sell Joey to the British cavalry and he is shipped to France where, after a disastrous offensive he is captured by the Germans and changes hands twice more before he is found, caught in the barbed wire in No Man's Land four years later and freed. He is returned behind British lines where Albert, now a private, has been temporarily blinded by gas, but still recognizes his beloved Joey. However, as the Armistice is declared Joey is set to be auctioned off. After all they have been through will Albert and Joey return home together?"
"Legends of the Fall","Drama,Romance,War","Set in the Rocky Mountains of Montana in the early 1900s, this is a tale of love, betrayal, and brotherhood. After being discharged, Colonel Ludlow decides to raise his three sons in the wilds of Montana, where they can grow up away from the government and society he has learned to despise. The three brothers mature and seem to have an unbreakable bond, until Susanna enters their lives. When Samuel, the youngest of the three, returns from college he brings with him his beautiful fiancée, Susanna. The eldest son, Alfred, soon finds himself in love with his brother's fiancée, and things get worse when he discovers a growing passion between Susanna and Tristan. Colonel Ludlow's favorite son, Tristan is willful and as wild as the mountains. As the brothers set out to fight a war in Europe, suspicion and jealousy threatens to tear apart their once indestructible bond."
"Flags of Our Fathers","Drama,History,War","In February, 1945, one of the fiercest battles of the Pacific theater of World War II occurs on the tiny island of Iwo Jima. Thousands of Marines attack the stronghold maintained by thousands of Japanese, and the slaughter on both sides is horrific. Early in the battle, an American flag is raised atop the high point, Mount Suribachi, and a photograph of the raising becomes an American cause celebre. As a powerful inspiration to war-sick Americans, the photo becomes a symbol of the Allied cause. The three surviving flag raisers, Rene Gagnon, John Bradley, and Ira Hayes, are whisked back to civilization to help raise funds for the war effort. But the accolades for heroism heaped upon the three men are at odds with their own personal realizations that thousands of real heroes lie dead on Iwo Jima, and that their own contributions to the fight are only symbolic and not deserving of the singling out they are experiencing. Each of the three must come to terms with the honors, exploitation, and grief that they face simply for being in a photograph."
