"The Best Years of Our Lives","Drama,Romance,War","At the end of World War II, a soldier, a sailor and an airman return to their home town of Boone City and must re-adjust to the society they had left several years before. Al Stephenson was a banker before joining up. He is older than your average war veteran and gets home to find that his children have grown up and faces the difficult task of re-establishing an intimate relationship with his loving wife. At work, Al is promoted but now finds it difficult to be the hardhearted banker he seemingly once was. Fred Derry was an Air Force Officer and Bombardier but realizes on his return that he has no marketable skills and finds himself in his old job at the pharmacy working as a soda jerk. He also finds that he had married in haste and that his wife, whom he'd only known for a few weeks when they married during his flight training, isn't quite as enamored with him now that he's out of uniform. Lastly, there is Homer Parrish who lost both of his hands in a shipboard fire. He's become quite adept at using the prosthetics the Navy has provided him but resents the pity he sees in others eyes. He had hoped to marry his childhood sweetheart but is no longer sure he can burden her with his own physical limitations. All three men become fast friends and with Fred Derry's marriage falling apart, he finds himself falling in love with Al's daughter, Peggy. In the end, all three finds ways to move forward with their lives."
"Red Cliff","Action,Adventure,Drama","In 208 A.D., in the Han Dinasty of China, the tyrannic and greedy Prime Minster Cao Cao forces the reluctant Emperor Han to declare war against the kingdoms of Liu Bei and Sun Quan in the South of China. Cao Cao heads with a mighty army of one million soldiers and attacks Liu Bei. His advisor and war strategist Zhuge Liang heads to South in a diplomatic mission trying to convince Sun Quan to join force with Liu Bei against the powerful warlord. When Zhuge Liang meets the viceroy Zhou Yu, he succeeds in his assignment with the alliance of the two kingdoms against Cao Cao. The armies fight against each other in many battles until the final one in Red Cliff where guile, knowledge and strategy prevail."
"The Guns of Navarone","Action,Adventure,Drama","1943. With the battle of Stalingrad turning the war against them, the Germans are attempting to bully neutral Turkey into joining the Axis; to this end they have trapped 2,000 British soldiers on Kiros, an island in the Aegean, with only one sea route for evacuation, a sea route commanded by two gigantic German antiship batteries deployed in a massive cliffside bunker on the island of Navarone. Immune to air attack and too much for Allied battleships to suppress, the British muster Keith Mallory, a commando officer who has been working on occupied Crete for nearly two years and who is an expert mountaineer, to ferry a team of British commandos to the only area of Navarone that is not monitored by the Germans, a 400-foot cliff. Greek resistance is to meet the team inland and guide them around German patrols to the area of the German guns. However, the commanding officer of the British team suffers grave injury in the climb and Mallory must take control of the mission, despite clashes with explosives expert John Anthony Miller, who upon the arrival of the night of the raid finds his equipment has been sabotaged, thus exposing a traitor in the team's ranks."
"Underground","Comedy,Drama,War","This movie reflects the history of Yugoslavia since the beginning of WWII (and similar to all ex-communist countries) to the last horrible events in Balcanian countries. Behind the comedy is hidden the pain of whole generations, which have suffered WWII, The Cold War, the war in Yugoslavia, the communism, the treachery of their own leadership, the fall. The film shows us the reality, as seen by those who feel unlimited love for their country and culture. Marko and Blacky represent the true leaders of country, the soul of nation and not without controversies."
"Judgment at Nuremberg","Drama,History,War","It's 1948 in Nuremberg, Germany, where the American military is holding a post-WWII tribunal on the activities of individuals within the Nazi Party leading up to and during the war. Dan Haywood is the lead judge in a three-man judiciary in one of those trials, where four men, who were involved in judicial matters, are the defendants. The general issues surrounding these four is whether they are guilty of international crimes or were just carrying out the laws of their national government, especially as they did not run or operate concentration camps for example, or purportedly know about what was happening to anyone they sentenced to life at those concentration camps. Of the four on trial, the largest question mark surrounds Dr. Ernst Janning, a globally renowned judge. Haywood, not being a well traveled man outside of the US, tries to get to know life in Germany, both then and now, to get a better perspective of the discussions at the trial. He befriends a Mrs. Bertholt as that conduit into German life. The counsel for the prosecution is led by Col. Tad Lawson, who wants to win at any cost, which includes trotting out the emotional aspects of the genocide at the concentration camps at whatever opportunity, regardless of if it actually applies to the defendants. The counsel for the defense is led by Hans Rolfe, who sees the proceedings as German self-determination on trial. Problems on both sides is getting the German public affected to talk about and thus testify about this emotionally traumatizing period of their past. But another issue in the background of this trial is the current Communist aggression, most specifically in Eastern Europe, and the Americans' need for German support in quashing this aggression, support which would be difficult to obtain if the Americans are putting Germans behind bars."
"Tae Guk Gi: The Brotherhood of War","Action,Drama,War","In 1950, in South Korea, shoe-shiner Jin-tae Lee and his 18-year-old old student brother, Jin-seok Lee, form a poor but happy family with their mother, Jin-tae's fiancé Young-shin Kim, and her young sisters. Jin-tae and his mother are tough workers, who sacrifice themselves to send Jin-seok to the university. When North Korea invades the South, the family escapes to a relative's house in the country, but along their journey, Jin-seok is forced to join the army to fight in the front, and Jin-tae enlists too to protect his young brother. The commander promises Jin-tae that if he gets a medal he would release his brother, and Jin-tae becomes the braver soldier in the company. Along the bloody war between brothers, the relationship of Jin-seok with his older brother deteriorates leading to a dramatic and tragic end."
"Kelly's Heroes","Action,Adventure,Comedy","During World War II a German Colonel is captured by the Americans but before he can be interrogated an artillery barrage hits the camp. However, Ex-Lieutenant Kelly manages to reach the Colonel, get him drunk and learn that he is on a secret mission to ship $16,000,000 of gold to a base in France. Kelly is determined to get the gold and plans for himself and a few of his fellow soldiers to slip into enemy territory and steal the bullion."
"Jin líng shí san chai","Drama,History,War","In 1937, the cynical mortician John Miller arrives at a Catholic Church in Nanjing that is under protection of the Red Cross to bury the local priest during the Japanese attack to the Capital of China. He finds only student girls and one young boy in the convent and he decides to spend the night in the church and travel on the next day. Soon a group of prostitutes from the local brothel by the river breaks in the church seeking a sanctuary and they hide in the basement. On the next morning, a Japanese platoon breaks in the Church and when the soldiers see the girls, they try to rape them. John wears the priest costume and poses like a priest to the invaders. He tries unsuccessfully to stop the Japanese, but the Chinese Major Li (Dawei Tong), who is the only survivor of his troop, prepares traps using bombs and destroys the whole platoon. Now John needs to decide whether he leaves Nanjing in the last ship or stays in the church protecting the naive girls."
"From Here to Eternity","Drama,Romance,War","In Hawaii in the months preceding the Japanese attack on Pearl Harbor, Pvt. Robert E. Lee Pruitt reports for his hew assignment as an infantryman. At his previous Post, Pruitt was a bugler and his unit's top boxer. After a man died in the ring however, Pruitt wants nothing to do with the sport. Trouble is, his new company commander, Captain Dana Holmes, has the championship boxing team and Pruitt's refusal to box results in most of the NCOs giving him a pretty hard time. Pruitt forms a close friendship with another GI, Angelo Maggio, who makes the mistake of crossing Sgt. Fatso Judson, the man in charge of the stockade. When Judson effectively beats Maggio to death, Pruitt seeks his revenge. Meanwhile, Company First Sgt. Milt Warden pursues and has an affair with Capt. Holmes's beautiful wife, Karen."
"Casualties of War","Drama,History,War","During the Vietnam war, a girl is taken from her village by five American soldiers. Four of the soldiers rape her, but the fifth refuses. The young girl is killed. The fifth soldier is determined that justice will be done. The film is more about the realities of war, rather than this single event."
"Lust, Caution","Drama,Romance,Thriller","Naive Wong Chia Chi is a college student in 1938 Hong Kong, to where many mainland Chinese have escaped from the bloodshed of the Sino-Japanese War. Her widowed father, abandoning her in China, escapes himself to England with her younger brother. On campus, she innocently gets involved with the politically active theater troupe led by Kuang Yu Min. Their plays protest the war, with Yu Min's stance particularly against any Chinese who collaborates with the Japanese. The productions' primary goal is to raise money for the resistance. Many Chinese do collaborate with the Japanese in part to maintain their upper class lifestyle. No longer solely content to hear the chants of "China will not fall" from their anti-Japanese audiences, Yu Min wants to venture into more direct activism by killing one of those collaborating with the Japanese, namely a Shanghai bigwig hiding out in Hong Kong named Mr. Yee to who they can get access through an old friend of Yu Min's. Despite all of them realizing that they know nothing about killing or espionage, they all agree. The expensive plot, funded by wealthy troupe member Liang Jun Sheng, involves Chia Chi acting as Mrs. Mak, the wife of a wealthy businessman, played by her fellow actor, Auyang Ling Wen. Although not originally the plan, Chia Chi becomes the center of the plot as she is the one who captures the attention of both Mr. and Mrs. Yee. The final act becomes more and more difficult to execute due to Mr. Yee's extremely cautious nature and despite his overwhelming evident lust for Mrs. Mak. The plot, which eventually involves those in the resistance who may have more expertise in espionage and killing, which moves to Shanghai and which covers the span of four years, changes Chia Chi fundamentally as a person, especially due to her developing love/hate relationship with Mr. Yee."
"The Battle of Algiers","Crime,Drama,History","In 1954, the National Liberation Front of Algiers shots many French policemen beginning a movement for the independence of their country; in return, the Chief of Police plants a bomb in the Arab quarter, killing many dwellers. The NLF sends three women with bombs to two bars and the Air France office in the European quarter, killing many people. The French government sends the military forces under the command of the abusive Colonel Mathieu that does not respect the human rights and uses torture to destroy the NLF command. In 1962, the Algerians finally achieve their aimed independence."
"The Messenger","Drama,Romance,War","While on a recent deployment to Iraq, US Army Staff Sergeant Will Montgomery is injured when an improvised explosive device goes off within close proximity to him. He is back in the States recovering from the more serious of those injuries, including one to his eye and leg. He has resumed a sexual relationship with his long time girlfriend Kelly, despite the fact that she is now engaged to another man who Will knows. With the few months Will has left in his enlistment, the army assigns him to the Casualty Notification Team in his area. Not having a background in counseling, psychology or grief management, he is unsure if he is well suited to this job. He is partnered with a career soldier, Captain Tony Stone, who teaches Will the precise protocol involved in the job. Tony tells Will, who quickly learns by on the job experience, that this job has its own dangers. As Will learns to adapt to the range of emotions of the next of kin, he is unprepared for the reaction of Olivia Pitterson, whose husband was killed in Iraq. His initial encounter with Olivia leads to him wanting to get to know her better, which may not be in either her or his best interest. Despite being a recovering alcoholic, the more experienced Tony tries to guide Will as best he can under their collective circumstances."
"Gallipoli","Adventure,Drama,History","World War I, 1915. Archy Hamilton (Mark Lee), a rising-star sprinter, sets aside his dreams to join the Australian Light Horse Division to fight in the war. He runs into fellow sprinter Frank Dunne (Mel Gibson), whom he convinces to join up with him. Unable to enter the Light Horse due to his inability to ride a horse, Frank is sent to Infantry, where he encounters some old buddies. Training commences, and Frank and Archy run into each other. With a special transfer to the Light Horse, Frank and Archy are sent to the Gallipoli Peninsula to fight the Turks. What they encounter shakes their beliefs about war. Can they survive the massacre?"
"Captain Corelli's Mandolin","Drama,Music,Romance","The idyllic beauty of Greece's Mediterranean coast has been invaded by Italy, bringing legions of soldiers to the once tranquil island of Cephallonia. Captain Antonio Corelli, an officer with an irrepressibly jovial personality and passion for the mandolin, initially alienates a number of the villagers, including Pelagia. The daughter of the village doctor, Pelagia is an educated and strong-willed woman, and while at first offended by the Italian soldier's behavior, she slowly warms to his certain charms as they are forced to share her father's home. When Pelagia's fiancee, a local fisherman, heads off to war, the friendship between Antonio and Pelagia grows even stronger. Her beauty and intelligence have captured his heart, and his fondness for the village's vibrant community causes him to question his reasons for fighting. Antonio becomes a part of the lives of the villagers, but the moment is fleeting. As the war grows ever closer, Antonio and Pelagia are forced to choose between their allegiance to their countries and the love they feel for one another-a love which must overcome tremendous odds, and endure the inevitable sacrifice which accompanies eternal devotion."
"The Four Feathers","Adventure,Drama,Romance","Set in 1884 Sudan, this fifth film to be adapted from the A.E.W. Mason novel follows a British officer who resigns his post right before his regiment ships out to battle the rebels. Perceiving his resignation as cowardice, his friends and fiancée give him four white feathers, the symbol of cowardice, but little do they know he's actually going undercover and plans to redeem his honor."
"Zulu","Drama,History,War","On the January 22nd 1879 the British Army suffered one of its worst defeats when Zulu forces massacred 1,500 of its troops at Isandlhwana. A short time after the main battle a Zulu force numbering in excess of 4000 warriors advanced on a British hospital and supply dump guarded by 139 Welsh infantrymen. The film concentrates on this bloody 12 hour battle during which the British force, under their commander from the Royal Engineers who happened to be in the area building a bridge and happened to be senior to the infantry officer, won 11 Victoria Crosses. While taking some liberties with history the film follows reality fairly closely, including matching exactly the identities of the VC winners."
"The Last Legion","Action,Adventure,Fantasy","Circa 460 A.D. Mira was born in a warrior-family in Kerala, India, was well versed in martial arts and self-defense, so much so that she was recruited by the Spanish royalty and re-located to Constantinople. From there she was instructed to assist Roman Commander Aurelius to plan the escape of 12-year old Romulus Augustus Caesar from a prison in Capri after his parents had been killed by the leader of the Alliance in turmoil-stricken Rome that has seen the deaths of five emperors in five years. Mira, Aurelius, and a Priest, Ambrosinius, along with a handful of loyal soldiers were successful in the escape plan and deliver Romulus to Roman Senator Nestor. What the crew do not realize is that their task is not over yet, for Nestor is all set to betray Romulus, leaving them with no alternative but to flee to Britannia, where they will be forced to confront a seemingly invincible Vortygn, whose main aim is to obtain a powerful sword that was meant for defense and defeat, and also ensure the death of Romulus at any and all costs."
"Red Tails","Action,Adventure,Drama","Italy, 1944. As the war takes its toll on Allied forces in Europe, a squadron of black pilots known as the Tuskegee Airmen are finally given the chance to prove themselves in the sky - even as they battle discrimination on the ground. It's a tribute to the unsung heroes who rose above extraordinary challenges and ultimately soared into history."
"Heartbreak Ridge","Action,Comedy,Drama","1983. Tom Highway is a well-decorated career military man in the United States Marine Corps, he who has seen action in Korea and Vietnam. His current rank is Gunnery Sergeant. His experiences have led him to become an opinionated, no nonsense man, who is prone to bursts of violence, especially when he's drunk, if the situation does not suit him, regardless of the specifics or people involved. Because of these actions, he has spent his fair share of overnighters behind bars. Close to retirement, one of his last assignments, one he requested, is back at his old unit at Cherry Point, North Carolina, from where he was transferred for insubordination. He is to train a reconnaissance platoon. His superior officer, the much younger and combat inexperienced Major Malcolm Powers, sees Highway as a relic of an old styled military. Highway's commanding officer, Lieutenant Ring, the platoon leader, is also a younger man who has no combat experience, but is academically inclined and happy-go-lucky. Highway finds that his team is a rag-tag bunch of slackers, who includes wannabe rock musician Stitch Jones, with who Highway had an inauspicious earlier meeting. The men in the platoon, who truly believe Highway is crazy, hate him, and don't understand why they have to follow his harsh training regimen when the United States is not currently at war. The major, who is all about efficiency regardless of combat readiness, has the same views of Highway. He is clear that he sees Highway's platoon solely as a training mechanism for his own elite squad trained by Highway's nemesis, Staff Sergeant Webster. Things for Highway and his platoon change when the United States enters into war in Grenada. Through it all, Highway tries to reconnect with his bar waitress ex-wife Aggie, he even clandestinely reading women's magazines to understand her better. Two primary obstacles stand in his way: Roy Jennings, Aggie's boss and current suitor who hates Marines, and Aggie's own remembrance of how dysfunctional their marriage was."
"Che: Part Two","Biography,Drama,History","In 1965, Ernesto 'Che' Guevara resigns from his Cuban government posts to secretly make his latest attempt to spread the revolution in Bolivia. After arriving in La Paz, Bolivia late in 1966, by 1967, Che with several Cuban volunteers, have raised a small guerrilla army to take on the militarist Bolivian movement. However, Che must face grim realities about his few troops and supplies, his failing health, and a local population who largely does not share his idealistic aspirations. As the US supported Bolivian army prepares to defeat him, Che and his beleaguered force struggle against the increasingly hopeless odds."
"Coriolanus","Drama,Thriller,War","The citizens of Rome are hungry. Coriolanus, the hero of Rome, a great soldier and a man of inflexible self-belief despises the people. His extreme views ignite a mass riot. Rome is bloody. Manipulated and out-maneuvered by politicians and even his own mother Volumnia, Coriolanus is banished from Rome. He offers his life or his services to his sworn enemy Tullus Aufidius."
"The Quiet American","Drama,Mystery,Romance","British Thomas Fowler enjoys his life in Saigon working as a reporter for the London Times covering the conflict in Vietnam between the colonial French powers and the communists, who seem to be winning the war. In the later stages of his career, he takes his job lightly now, filing stories only on occasion, and no longer doing field work. But most importantly, this posting allows him to escape from what he considers a dreary life in London - including an unsatisfying marriage to a Catholic woman, who will never grant him a divorce - which in turn allows him to have an affair with a young Vietnamese ex-taxi dancer named Phuong, who he loves and would marry if he was able. Phuong's sister doesn't much like Fowler if only because Fowler cannot provide a stable future for her. His idyllic life is threatened when head office suggests he go back to London. As such, he decides to write a major story to prove to his superiors that he should stay in Saigon. In 1952, Fowler is called into the local police inspector's office to provide any information on his friend, thirty-ish American Alden Pyle, who was found murdered. Fowler had met Pyle the previous year when he arrived in Vietnam to work as part of the American contingent in the Economic Aid Mission. Fowler and Pyle's relationship was not always harmonious, initially as Pyle admitted he too was in love with Phuong and wanted to marry her. That antagonistic relationship would extend to their professional lives, around Fowler believing that the story which would allow him to stay in Vietnam was the rise of a man named General Thé, and Pyle's belief that a third power should come in to take over Vietnam from both the French and the communists. The question becomes if Fowler knows more about Pyle's demise than he lets on to the inspector."
"Goya's Ghosts","Biography,Drama,War","The painter Goya becomes involved with the Spanish Inquisition when his muse, Ines, is arrested by the church for heresy. Her father, Thomas, comes to him hoping that his connection with Brother Lorenzo, whom he is painting, can secure the release of his daughter."
"Tomorrow, When the War Began","Action,Adventure,War","Seven Australian teenage friends from a small town go on a camping trip to be with nature. During their trip, they see military aircraft fly overhead. What they didn't know was their country was being invaded by another country. Returning home, they discover that they are at war. With no training, they band together to fight the enemy."
"Love and Death","Comedy,War","In Russia, Boris Grushenko is in love with his pseudo-intellectual cousin Sonja, who loves him since he too is a pseudo-intellectual, but she is not in love with him. Instead she is in love with his brother Ivan. But as Ivan doesn't seem to return her affections, she is determined to marry someone - anyone - except Boris. If that person isn't the perfect husband, then she has to find a suitable lover in addition. Boris' pursuit of Sonja has to take a back seat in his life when he, a pacifist and coward, is forced to join the Russian Army to battle Napoleon's forces which have just invaded Austria. Despite Sonja not being in the picture while he's away at war, Boris' thoughts do not stray totally from women. Although they take these two divergent paths in their lives, those paths cross once again as they, together, both try to find the perfect spouse and lover, and try to assassinate Napoleon."
"La Grande Illusion","Drama,War","During WWI, French Captain de Boeldieu and Lieutenant Maréchal are shot down over Germany by Captain von Rauffenstein during a reconnaissance mission. The two French officers are captured. There is an instant rapport between von Rauffenstein and de Boeldieu, who he sees like himself, a career military man of high rank who should be afforded the respect of the position. This hierarchy has nothing to do with life outside of the military. Even at the Hallbach POW camp where they are initially housed, de Boeldieu and Maréchal are treated differently within the ranks of the other POWs. de Boeldieu and Maréchal themselves treat each other cordially but with guarded friendship, only because of their current situation. Time does not change their relationship. This hierarchy becomes more pronounced when de Boeldieu and Maréchal among others are transferred to Wintersborn POW camp on the request of von Rauffenstein, who is now the commandant there. Since their last meeting, von Rauffenstein was permanently injured leading to this new assignment at Wintersborn, a converted 13th century castle. When Maréchal and fellow captive Rosenthal muse about their next escape attempt, de Boeldieu understands his position in the plot which is in keeping with his position among the other POWs and his special relationship with von Rauffenstein."
