"Saving Private Ryan","Action,Drama,War","Opening with the Allied invasion of Normandy on 6 June 1944, members of the 2nd Ranger Battalion under Cpt. Miller fight ashore to secure a beachhead. Amidst the fighting, two brothers are killed in action. Earlier in New Guinea, a third brother is KIA. Their mother, Mrs. Ryan, is to receive all three of the grave telegrams on the same day. The United States Army Chief of Staff, George C. Marshall, is given an opportunity to alleviate some of her grief when he learns of a fourth brother, Private James Ryan, and decides to send out 8 men (Cpt. Miller and select members from 2nd Rangers) to find him and bring him back home to his mother..."
"Schindler's List","Biography,Drama,History","Oskar Schindler is a vainglorious and greedy German businessman who becomes unlikely humanitarian amid the barbaric Nazi reign when he feels compelled to turn his factory into a refuge for Jews. Based on the true story of Oskar Schindler who managed to save about 1100 Jews from being gassed at the Auschwitz concentration camp. A testament for the good in all of us."
"Inglourious Basterds","Adventure,Drama,War","It's WWII, the battleground, Nazi-occupied France. The Nazis are doing whatever they need to to flush out and exterminate Jews, the most proficient and prolific of the Jew hunters being the sadistic SS Colonel Hans Landa. As such, the American military forms a unit, led by Lieutenant Aldo Raine and comprised of eight Jews, to kill as many Nazis as possible. Raine requests each of his men to bring him the scalp of at least 100 Nazis apiece. He has his own method of ensuring that those Nazis he does allow or need to let go free are scarred for life. In Paris in 1944, Joseph Goebbels, the Nazi's chief propaganda master and filmmaker, plans to debut his latest film, "Nation's Pride". The film, based on the victorious military exploits of Private Fredrick Zoller, stars Zoller as himself. Because of his attraction to its pretty proprietress Emmanuelle Mimieux, Zoller convinces Goebbels and the Nazi brass to hold the premiere at Mimieux's cinema. Landa is to act as chief of security for the event. When the Americans get wind of the screening and the fact that most of the Nazi highers-up will be in attendance, Raine's team is tasked with blowing up the cinema during the screening. They are assisted by renowned German actress, Bridget von Hammersmark, who has been working as a spy for the British. They believe luck is on their side when they learn that Hitler himself is scheduled to attend. Beyond being found out, Raine's team face two as of yet unknown issues. The first is Mimieux, who is really Shoshanna Dreyfus, a Jew who saw her family brutally murdered by Landa four years earlier, and who may have her own plans for Landa and the Nazis. The second is Landa, who beyond his up front mission, has another more personal mission for his life post-war unknown to anyone but himself."
"Braveheart","Action,Biography,Drama","William Wallace is a Scottish rebel who leads an uprising against the cruel English ruler Edward the Longshanks, who wishes to inherit the crown of Scotland for himself. When he was a young boy, William Wallace's father and brother, along with many others, lost their lives trying to free Scotland. Once he loses another of his loved ones, William Wallace begins his long quest to make Scotland free once and for all, along with the assistance of Robert the Bruce."
"300","Action,Fantasy,History","300 tells the story of the Battle of Thermopylae in 480 B.C. Persians under the rule of King Xerxes have already taken over some of the Hellenic city-states, and now threaten Sparta and Athens. King Leonidas of Sparta is left with two options: he will either have to sacrifice himself for the well-being of Sparta or watch it burn to the ground. Choosing the former, Leonidas forms an army of 300 Spartan warriors to block the narrow passage of Thermopylae where Xerxes intends to reach Hellas. The 300 are accompanied by about 700 Thespians who protect the flanks of the passage, and combined, the forces manage to slay tens of thousands of Persians and prevent their entry into Hellas for several days. However, Ephialtes, a reject of the Spartan Army gets his revenge by showing Xerxes a secret goat passage up the flanks of the passage. The story depicts the epic last stand of the finest Spartan soldiers who are aware of their fate, but motivated by "honor and glory", see the battle as their duty to protect the rest of Greece for as long as possible."
"El laberinto del fauno","Drama,Fantasy,War","In 1944, in the post-Civil War in Spain, rebels still fight in the mountains against the fascist troops. The young and imaginative Ofelia travels with her pregnant and sick mother Carmen Vidal to the country to meet and live with her stepfather, the sadistic and cruel Captain Vidal, in an old mill. During the night, Ofelia meets a fairy and together they go to a pit in the center of a maze where they meet a faun that tells that she is a princess from a kingdom in the underground. He also tells that her father is waiting for her, but she needs to accomplish three gruesome, tough and dangerous assignments first. Meanwhile, she becomes friend of the servant Mercedes, who is the sister of one of the rebels and actually is giving support to the group. In a dark, harsh and violent world, Ofelia lives her magical world trying to survive her tasks and sees her father and king again."
"Apocalypse Now","Drama,War","It is the height of the war in Vietnam, and U.S. Army Captain Willard is sent by Colonel Lucas and a General to carry out a mission that, officially, 'does not exist - nor will it ever exist'. The mission: To seek out a mysterious Green Beret Colonel, Walter Kurtz, whose army has crossed the border into Cambodia and is conducting hit-and-run missions against the Viet Cong and NVA. The army believes Kurtz has gone completely insane and Willard's job is to eliminate him! Willard, sent up the Nung River on a U.S. Navy patrol boat, discovers that his target is one of the most decorated officers in the U.S. Army. His crew meets up with surfer-type Lt-Colonel Kilgore, head of a U.S Army helicopter cavalry group which eliminates a Viet Cong outpost to provide an entry point into the Nung River. After some hair-raising encounters, in which some of his crew are killed, Willard, Lance and Chef reach Colonel Kurtz's outpost, beyond the Do Lung Bridge. Now, after becoming prisoners of Kurtz, will Willard & the others be able to fulfill their mission?"
"Full Metal Jacket","Drama,War","Full Metal Jacket begins by following the trials and tribulations of a platoon of fresh Marine Corps recruits focusing on the relationship between Gunnery Sergeant Hartman and Privates Pyle and Joker. We see Pyle grow into an instrument of death as Hartman has foreseen of all of his recruits. Through Pyle's torment and Joker's unwillingness to stand up against it the climax of part one is achieved with all three main characters deciding their fates by their action or inaction. The second chapter delves into Joker's psyche and the repeated referral to the fact that he joined the Corps to become a killer. When his mostly behind the scenes job as a combat correspondent is interfered with by the Tet offensive he is thrust into real combat and ultimately must decide if he really is a killer."
"The Pianist","Biography,Drama,History","The true story of Wladyslaw Szpilman who, in the 1930s, was known as the most accomplished piano player in all of Poland, if not Europe. At the outbreak of the Second World War, however, Szpilman becomes subject to the anti-Jewish laws imposed by the conquering Germans. By the start of the 1940s, Szpilman has seen his world go from piano concert halls to the Jewish Ghetto of Warsaw and then must suffer the tragedy of his family deported to a German concentration camps, while Szpilman is conscripted into a forced German Labor Compound. At last deciding to escape, Szpilman goes into hiding as a Jewish refugee where he is witness to the Warsaw Ghetto Uprising (April 19, 1943 - May 16, 1943) and the Warsaw Uprising (1 August to 2 October 1944)"
"Casablanca","Drama,Romance,War","During World War II, Europeans who were fleeing from the Germans, sought refuge in America. But to get there they would first have to go Casablanca and once they get there, they have to obtain exit visas which are not very easy to come by. Now the hottest spot in all of Casablanca is Rick's Cafe which is operated by Rick Blaine, an American expatriate, who for some reason can't return there, and he is also extremely cynical. Now it seems that two German couriers were killed and the documents they were carrying were taken. Now one of Rick's regulars, Ugarte entrusts to him some letters of transit, which he intends to sell but before he does he is arrested for killing the couriers. Captain Renault, the Chief of Police, who is neutral in his political views, informs Rick that Victor Laszlo, a resistance leader from Czechoslovakia, is in Casablanca and will do anything to get an exit visa but Renault has been "told" by Major Strasser of the Gestapo, to keep Laszlo in Casablanca. Laszlo goes to Rick's to meet Ugarte, because he was the one Ugarte was going to sell the letters to. But since Ugarte was arrested he has to find another way. Accompanying him is Ilsa Lund, who knew Rick when he was in Paris, and when they meet some of Rick's old wounds reopen. It is obvious that Rick's stone heart was because of her leaving him. And when they learn that Rick has the letters, he refuses to give them to him, because "he doesn't stick his neck out for anyone"."
"Dr. Strangelove or: How I Learned to Stop Worrying and Love the Bomb","Comedy,Sci-Fi,War","Paranoid Brigadier General Jack D. Ripper of Burpelson Air Force Base, he believing that fluoridation of the American water supply is a Soviet plot to poison the U.S. populace, is able to deploy through a back door mechanism a nuclear attack on the Soviet Union without the knowledge of his superiors, including the Chair of the Joint Chiefs of Staff, General Buck Turgidson, and President Merkin Muffley. Only Ripper knows the code to recall the B-52 bombers and he has shut down communication in and out of Burpelson as a measure to protect this attack. Ripper's executive officer, RAF Group Captain Lionel Mandrake (on exchange from Britain), who is being held at Burpelson by Ripper, believes he knows the recall codes if he can only get a message to the outside world. Meanwhile at the Pentagon War Room, key persons including Muffley, Turgidson and nuclear scientist and adviser, a former Nazi named Dr. Strangelove, are discussing measures to stop the attack or mitigate its blow-up into an all out nuclear war with the Soviets. Against Turgidson's wishes, Muffley brings Soviet Ambassador Alexi de Sadesky into the War Room, and get his boss, Soviet Premier Dimitri Kisov, on the hot line to inform him of what's going on. The Americans in the War Room are dismayed to learn that the Soviets have a yet as unannounced Doomsday Device to detonate if any of their key targets are hit. As Ripper, Mandrake and those in the War Room try and work the situation to their end goal, Major T.J. "King" Kong, one of the B-52 bomber pilots, is working on his own agenda of deploying his bomb where ever he can on enemy soil if he can't make it to his intended target."
"Life Is Beautiful","Comedy,Drama,Romance","In 1939, Jewish-Italian Guido Orefice comes into Arezzo, Italy, ultimately to open a book store. In the meantime, he will work as a waiter at the hotel restaurant where his Uncle Eliseo is the maître d'. In town, he meets a school teacher named Dora, who he calls Princess and who comes from a wealthy Italian family. For him, it's love at first sight. Despite she already being in a relationship with another man, Guido ultimately sweeps her off her feet. They get married and have a son they name Giosué. On Giosué's fifth birthday, World War II is in full force. Since they are Jewish, the Germans take away Guido, Eliseo and Giosué to a labor camp. Wanting to be with her family, Dora insists she be taken too, but she is housed in the women's side of the camp. To protect Giosué from the horror of what is happening to them, Guido tells him that they are playing a game, certain actions which garner points, other actions which take points away or disqualify one from the game. The first to reach 1,000 points wins the prize of a real tank. Guido's primary goal is to keep Giosué safe at all cost, while he tries to figure out a way to get his family out of the camp and keep the Germans at bay from learning what he is doing with Giosué."
"The Last Samurai","Action,Drama,History","In the 1870s, Captain Nathan Algren, a cynical veteran of the American Civil war who will work for anyone, is hired by Americans who want lucrative contracts with the Emperor of Japan to train the peasant conscripts for the first standing imperial army in modern warfare using firearms. The imperial Omura cabinet's first priority is to repress a rebellion of traditionalist Samurai -hereditary warriors- who remain devoted to the sacred dynasty but reject the Westernizing policy and even refuse firearms. Yet when his ill-prepared superior force sets out too soon, their panic allows the sword-wielding samurai to crush them. Badly wounded Algren's courageous stand makes the samurai leader Katsumoto spare his life; once nursed to health he learns to know and respect the old Japanese way, and participates as advisor in Katsumoto's failed attempt to save the Bushido tradition, but Omura gets repressive laws enacted- he must now choose to honor his loyalty to one of the embittered sides when the conflict returns to the battlefield..."
"The Hurt Locker","Drama,Thriller,War","US Army Sergeant First Class Will James, Sergeant JT Sanborn and Specialist Owen Eldridge comprise the Bravo Company's bomb disposal unit currently stationed in Baghdad. James is the tech team leader. When James arrives on the scene, Bravo Company has thirty-nine days left on its current deployment. It will be a long thirty-nine days for Sanborn and Eldridge whose styles do not mesh with their new leader. James is a renegade for who the thrill of the dismantlement seems to be the ultimate goal regardless of the safety of his fellow team members, others on the scene or himself. On the other hand, Sanborn is by the books: he knows his place and duty and trusts others in the army to carry out theirs as well as he. And Eldridge is an insecure soldier who is constantly worried that an error or misjudgment on his part will lead to the death of an innocent civilian or a military colleague. While the three members face their own internal issues, they have to be aware of any person at the bomb sites, some of who may be bombers themselves."
"Black Hawk Down","Drama,History,War","Action/war drama based on the best-selling book detailing a near-disastrous mission in Somalia on October 3, 1993. On this date nearly 100 U.S. Army Rangers, commanded by Capt. Mike Steele, were dropped by helicopter deep into the capital city of Mogadishu to capture two top lieutenants of a Somali warlord. This lead to a large and drawn-out firefight between the Rangers and hundreds of Somali gunmen, leading to the destruction of two U.S. Black Hawk helicopters. This film focuses on the heroic efforts of various Rangers to get to the downed black hawks, centering on Sgt. Eversmann, leading the Ranger unit Chalk Four to the first black hawk crash site, Warrant Officer Durant who was captured after being the only survivor of the second black hawk crash, as well as many others who were involved."
"Platoon","Action,Drama,War","Chris Taylor is a young, naive American who gives up college and volunteers for combat in Vietnam. Upon arrival, he quickly discovers that his presence is quite nonessential, and is considered insignificant to the other soldiers, as he has not fought for as long as the rest of them and felt the effects of combat. Chris has two non-commissioned officers, the ill-tempered and indestructible Staff Sergeant Robert Barnes and the more pleasant and cooperative Sergeant Elias Grodin. A line is drawn between the two NCOs and a number of men in the platoon when an illegal killing occurs during a village raid. As the war continues, Chris himself draws towards psychological meltdown. And as he struggles for survival, he soon realizes he is fighting two battles, the conflict with the enemy and the conflict between the men within his platoon."
"Pearl Harbor","Action,Drama,Romance","Rafe and Danny are best friends who are also pilots. When World War II breaks out in Europe, America chooses not to join but they train nonetheless, so Rafe and Danny join the Army Air Corps. Rafe meets a nurse named Evelyn and falls for her. But when he gets an opportunity to go join the Britsh Air Corps, he jumps at it. Shortly after he leaves, he gets shot down and is reported killed. Danny and Evelyn who are stationed in Pearl Harbor, lean on each other after learning of what happened to Rafe. It isn't long that they're together. But suddenly Rafe returns. And when he learns about them, he freaks out and he goes after Danny. But suddenly Pearl Harbor is attacked, and they shoot down some the planes attacking them. Later, Roosevelt decides to retaliate against Japan and Colonel Doolittle is placed in charge and asks Rafe and Danny to join him and they accept knowing that the chances of them coming back is slim. But things between them are still tense."
"Hotel Rwanda","Biography,Drama,History","Ten years ago some of the worst atrocities in the history of mankind took place in the country of Rwanda--and in an era of high-speed communication and round the clock news, the events went almost unnoticed by the rest of the world. In only three months, one million people were brutally murdered. In the face of these unspeakable actions, inspired by his love for his family, an ordinary man summons extraordinary courage to save the lives of over a thousand helpless refugees, by granting them shelter in the hotel he manages."
"Downfall","Biography,Drama,History","A non-political person, Traudl Junge, then twenty-four years old and the personal secretary to Adolf Hitler, recounts the two weeks in her life starting on April 20, 1945, the day of Hitler's 56th birthday. Spent primarily in the Führer's bunker, she and many of the leaders of the Nazi party were taking refuge from the siege of Berlin by the advancing Russian troops. It seemed almost a guarantee that the Russians would take control of the city and that Germany would lose the war. Hitler and his military were trying to decide what to do, many giving Hitler the advice of getting out of Berlin and/or surrendering to save the lives of the German civilian population. Hitler made up his own decisions on what he felt stood for his own political ideals, and treated anyone, even during these tenuous times, as being treasonous if they disobeyed his orders. Regardless, many ended up doing what they felt best for themselves despite possible execution by their own if they disobeyed the Führer. As the situation for the Nazi's became more desperate, the more desperate their individual actions became, some following their Führer to the end."
"The Deer Hunter","Drama,War","Michael, Nick, and Steven are three buddies from the steel mill town of Clairton, Penn.They are like schoolmates, hanging out in a local bar and enjoying weekends of deer-hunting. Michael and Nick are also both in love with Linda, who seems to juggle both of the men. But their placid life is soon to be changed after they are enlisted in the airborne infantry of Vietnam. So they all celebrate a goodbye at Steven's wedding and they leave to Vietnam, where they are captured by the enemy and forced to play a game of Russian Roulette. They escape and return home, but their lives are forever changed. Nick stays in Vietnam, Michael returns to Linda, and Steven is handicapped after losing a leg in the war."
"Kingdom of Heaven","Action,Adventure,Drama","It is the time of the Crusades during the Middle Ages - the world shaping 200-year collision between Europe and the East. A blacksmith named Balian has lost his family and nearly his faith. The religious wars raging in the far-off Holy Land seem remote to him, yet he is pulled into that immense drama. Amid the pageantry and intrigues of medieval Jerusalem he falls in love, grows into a leader, and ultimately uses all his courage and skill to defend the city against staggering odds. Destiny comes seeking Balian in the form of a great knight, Godfrey of Ibelin, a Crusader briefly home to France from fighting in the East. Revealing himself as Balian's father, Godfrey shows him the true meaning of knighthood and takes him on a journey across continents to the fabled Holy City. In Jerusalem at that moment--between the Second and Third Crusades--a fragile peace prevails, through the efforts of its enlightened Christian king, Baldwin IV, aided by his advisor Tiberias, and the military restraint of the legendary Muslim leader Saladin. But Baldwin's days are numbered, and strains of fanaticism, greed, and jealousy among the Crusaders threaten to shatter the truce. King Baldwin's vision of peace--a kingdom of heaven--is shared by a handful of knights, including Godfrey of Ibelin, who swear to uphold it with their lives and honor. As Godfrey passes his sword to his son, he also passes on that sacred oath: to protect the helpless, safeguard the peace, and work toward harmony between religions and cultures, so that a kingdom of heaven can flourish on earth. Balian takes the sword and steps into history."
"The Patriot","Action,Drama,War","It is 1776 in colonial South Carolina. Benjamin Martin, a French-Indian war hero who is haunted by his past, now wants nothing more than to live peacefully on his small plantation, and wants no part of a war with the most powerful nation in the world, Great Britain. Meanwhile, his two eldest sons, Gabriel and Thomas, can't wait to enlist in the newly formed "Continental Army." When South Carolina decides to join the rebellion against England, Gabriel immediately signs up to fight...without his father's permission. But when Colonel William Tavington, British dragoon, infamous for his brutal tactics, comes and burns the Martin Plantation to the ground, tragedy strikes. Benjamin quickly finds himself torn between protecting his family, and seeking revenge along with being a part of the birth of a new, young, and ambitious nation."
"Gone with the Wind","Drama,Romance,War","This tale of the Old South from the start of the Civil War through to the period of reconstruction focuses on the beautiful Scarlett O'Hara. Before the start of the war life at the O'Hara plantation, Tara, could only be described as genteel. As for the young Scarlett, she is without doubt the most beautiful girl in the area and is always the belle of the ball. She is very much looking forward to a barbecue at the nearby Wilkes plantation as she will get to see the man she loves, Ashley Wilkes. She is more than a little dismayed when she hears that he is to marry his cousin Melanie Hamilton and in a fit of anger, she decides to marry Melanie's brother. War is soon declared and as always seems to be the case, men march off to battle thinking that it will only last a few weeks. Now living in Atlanta, Scarlett sees the ravages that war brings. She also becomes re-acquainted with Rhett Butler, whom she had first met at the Wilkes barbecue. Now a widow, she still pines for the married Ashley and dreams of his return. With the war lost however, she returns to Tara and faces the hardship of keeping her family together and Tara from being sold at auction to collect the taxes. She has becomes hardened and bitter and will do anything, including marrying her sister's beau, to ensure she will never again be poor and hungry. After becoming a widow for the second time, she finally marries the dashing Rhett but they soon find themselves working at cross-purposes, their relationship seemingly doomed from the outset."
"Atonement","Drama,Mystery,Romance","In 1939, Robbie Turner is a private in the British Army, he and his battalion who are heading to France to fight in the war. A stint in the army is not where his life was headed, which took a radical turn four years earlier at the Tallis estate where he grew up as his mother worked as the Tallis' live-in housekeeper. As such, he grew up with the three Tallis children: son Leon, and daughters Cecilia and Briony. Robbie and Cecilia were just getting to the stage of their lives of being able to confess their true love for each other. But then thirteen year old aspiring writer Briony also had a crush on the older Robbie. Based on two incidents she saw between Cecilia and Robbie (one only from afar), on reading a private letter Robbie wrote to Cecilia and on her own feelings for Robbie, Briony told some truths and half-truths about Robbie which resulted in this turn in his life. Robbie is able to reconnect with Cecilia before he is shipped off to France, and lives only to be able to head back to London to be with Cecilia and make up for the missing four years they could not spend together due to Briony's actions. A year later, Briony, now eighteen, also arrives in London to start working as a nurse to support the war effort. By this time, she is aware of the damage her thirteen year old self caused, and wants to atone for that error to both Cecilia from who she has been estranged, and Robbie who she has not seen since. She will make this atonement even if neither Robbie or Cecilia will ever speak to her, or if it takes the rest of her life."
